text,topic,group,isDup,sentimentValue,sentiment
His night got two of nd all proud of that shit but wonder where his and aids come from s all wild,HIV/AIDS,HIV/AIDS and tuberculosis,0.0,0.0,Neutral
His of Times reporter has passed away but it is worthwhile to read what she had to say about breast cancer and,Breast cancer,Neoplasms,0.0,-10.0,Negative
His sweet needs and epilepsy warning,Epilepsy,Neurological disorders,0.0,10.0,Positive
His year Teatru plugged is supporting breast cancer research through the RIDT University of Malta Research,Breast cancer,Neoplasms,0.0,0.0,Neutral
Historian bill moves to realise medicinal connais cultivation v MME epilepsy,Epilepsy,Neurological disorders,0.0,0.0,Neutral
Historian diseases from scarlet fever to cholera and tuberculosis are making a London comeback,Tuberculosis,HIV/AIDS and tuberculosis,0.0,-10.0,Negative
Historian Diseases Like Measles and Tuberculosis on the Rise in England Historian rise,Tuberculosis,HIV/AIDS and tuberculosis,0.0,0.0,Neutral
HIV AIDS Now Everyone Benefits From Undetectable Girl Road Suppressing the HIV virus to undetectable levels has long played a,HIV/AIDS,HIV/AIDS and tuberculosis,0.0,10.0,Positive
HIV AIDS Status que threatens to detail the progress report says,HIV/AIDS,HIV/AIDS and tuberculosis,0.0,20.0,Positive
HIV Lids is not even Totally over yet and there s already a new virus Ladies and Gentlemen the Superbug,HIV/AIDS,HIV/AIDS and tuberculosis,0.0,0.0,Neutral
HIV News Illinois Biotechnology Industry Organization Announces Horizon Harm Chairman and CEO Timothy P A,HIV/AIDS,HIV/AIDS and tuberculosis,0.0,-10.0,Negative
HIV News SHAREHOLDER NOTICE Goldberg Saw of Announces an Going Investigation of Claims against KaloBios Ha,HIV/AIDS,HIV/AIDS and tuberculosis,0.0,0.0,Neutral
Holiday discount on FDA approved AfibAlert monitor for trial fibrillation patients fig,Atrial fibrillation,Cardiovascular and circulatory diseases,0.0,10.0,Positive
Holy Whistle Armenia Benedict 50G Ragged River All Bladder Health may,Gall bladder,Digestive diseases (except cirrhosis),0.0,0.0,Neutral
Homeless people have diabetes too,Diabetes,"Diabetes, urogenital, blood, and endocrine diseases",0.0,0.0,Neutral
hope  of 2 days after the abortion and already got my cut body back In t no cock blocking baby getting in the way of my fun http,Abortion,Maternal disorders,0.0,20.0,Positive
hope  of 20 000 new cases of ovarian cancer per year That s too many Tapping Cancer Farmers team,Ovarian cancer,Neoplasms,0.0,10.0,Positive
Hope van echo a big boss both are cancers K lung cancer to e liver,Liver cancer,Neoplasms,0.0,10.0,Positive
Horrified pneumoconiosis back Black day for mining industry as deadly disease surfaces via,Pneumoconiosis,Chronic respiratory diseases,0.0,-10.0,Negative
Hotel Williams on Multiple Sclerosis Multiple Sclerosis News Today,multiple sclerosis,Neurological disorders,0.0,0.0,Neutral
how to get diabetes after eating 20 of these,Diabetes,"Diabetes, urogenital, blood, and endocrine diseases",0.0,0.0,Neutral
However on route to overtake assimilation your intellectual faculty whereby yours ischaemic heart disease to,Ischemic heart,Cardiovascular and circulatory diseases,0.0,0.0,Neutral
HPV prevalence and type distribution in cervical cancer and premalignant lesions of the croix A tumorimmuno,Cervical cancer,Neoplasms,0.0,0.0,Neutral
HPV vaccine Millions of women are missing out on the chance to prevent cervical cancer,Cervical cancer,Neoplasms,0.0,20.0,Positive
HPV West Seats Cap To Spot Cervical Cancer conscioushealthsolutions health,Cervical cancer,Neoplasms,0.0,0.0,Neutral
HRC launched new efforts to tackle HIV amp AIDS,HIV/AIDS,HIV/AIDS and tuberculosis,0.0,10.0,Positive
Human IGF1 pro forms induce breast cancer cell proliferation via the IGF1 receptor,Breast cancer,Neoplasms,0.0,0.0,Neutral
Hundreds potentially exposed to tuberculosis at hospital via,Tuberculosis,HIV/AIDS and tuberculosis,0.0,0.0,Neutral
Hung Cancer Round To He Genetically Different Disease In Young And Older Patients Science 2 0 cancer,lung cancer,Neoplasms,0.0,0.0,Neutral
Hyperoside induces proptosis and inhibit growth in pancreatic cancer via All 2 family and of B signaling pathway,Pancreatic cancer,Neoplasms,0.0,10.0,Positive
Hypertension is a major risk factor for stroke aneurysms of the arteries peripheral arterial disease and chronic kidney disease,Peripheral Arterial disease,Cardiovascular and circulatory diseases,0.0,-20.0,Negative
Hypertension puts strain on the heart possibly leading to hypertensive heart disease and coronary artery disease,Hypertensive heart disease,Cardiovascular and circulatory diseases,0.0,0.0,Neutral
Hypertrophic cardiomyopathy HCM is a common heart disease in all cats and is most commonly genetic in cause Ragdoll,Cardiomyopathy,Cardiovascular and circulatory diseases,0.0,0.0,Neutral
Hypertrophic cardiomyopathy HCM is a genetic disorder that has a variable presentation and carries a high incidence of sudden death,Cardiomyopathy,Cardiovascular and circulatory diseases,0.0,-10.0,Negative
Hypoxia promotes C X C chemokine receptor type 4 expression through microRNA 150 in pancreatic cancer cells,Pancreatic cancer,Neoplasms,0.0,0.0,Neutral
I added a video to a playlist BLEEDING PEPTIC ULCER amp OPERATIONS,Peptic ulcer,Digestive diseases (except cirrhosis),0.0,-10.0,Negative
I added a video to a playlist New developments in the treatment of non Hodgkin lympho Or God,Non-Hodgkin lymphoma,Neoplasms,0.0,10.0,Positive
I added a video to a playlist On Hodgkin s Lymphoma Survivor Late Haleblian,Non-Hodgkin lymphoma,Neoplasms,0.0,10.0,Positive
I added a video to a playlist septic ulcer and choice of operation,Peptic ulcer,Digestive diseases (except cirrhosis),0.0,0.0,Neutral
I am designing a webster to educate the masses on kidney disease May I write a blow post on your experiences,kidney disease,"Diabetes, urogenital, blood, and endocrine diseases",0.0,0.0,Neutral
I am losing a friend soon Diagnosed with liver cancer He refuses to say timeline Must that its happening and soon st time dealing with,Liver cancer,Neoplasms,0.0,-10.0,Negative
i ate so much i had to take paracetemol for the pain and now i have asthma christmas,Asthma,Chronic respiratory diseases,0.0,-10.0,Negative
I can handle a lot of pains but lung pain or pancreatitis is a fucking deal breakers,Pancreatitis,Digestive diseases (except cirrhosis),0.0,-20.0,Negative
I d find you and plant lung cancer in your lungs,lung cancer,Neoplasms,0.0,0.0,Neutral
I d much rather have pancreatic cancer than ever vote to labour I ll never ever ever vote for them I can t stand them may,Pancreatic cancer,Neoplasms,0.0,0.0,Neutral
I don t care smoke fucking cigarettes but not around me I m not going to get cancer or have an asthma attack for a fucking drug,Asthma,Chronic respiratory diseases,0.0,-20.0,Negative
I don t really want to be unkind but last night we saw 397 cases of not early enough onset Alzheimer s SyriaVote,Alzheimer,Neurological disorders,0.0,0.0,Neutral
I donate 0 08 to National Multiple Sclerosis Society instant,multiple sclerosis,Neurological disorders,0.0,0.0,Neutral
i dont know if i know anyone with epilepsy but who knows i dont know everyone who follows me,Epilepsy,Neurological disorders,0.0,0.0,Neutral
I feel like death and I want to cry but that ll only make my migrate worse,Migraine,Neurological disorders,0.0,-30.0,Negative
i feel like i might actually have an asthma attack,Asthma,Chronic respiratory diseases,0.0,0.0,Neutral
I feel like my asthma is going to be acting up with this weather,Asthma,Chronic respiratory diseases,0.0,0.0,Neutral
I feel sick so i didn go to work my stomach hurts pancreatitis pus calm itself,Pancreatitis,Digestive diseases (except cirrhosis),0.0,-20.0,Negative
I found it useful for my thesis on the economic evaluation of HPV vaccination for cervical cancer prevention,Cervical cancer,Neoplasms,0.0,20.0,Positive
I gall bladder for that mug is a fair trade I think,Gall bladder,Digestive diseases (except cirrhosis),0.0,0.0,Neutral
I get in such a bad mood when my stomach hurts Pancreatitis fuck you,Pancreatitis,Digestive diseases (except cirrhosis),0.0,-20.0,Negative
I got asthma trying to read this,Asthma,Chronic respiratory diseases,0.0,0.0,Neutral
I got my christmas pancreatitis how about you nomorecodliver,Pancreatitis,Digestive diseases (except cirrhosis),0.0,0.0,Neutral
i got sick too D its either that or seasonal minor asthma,Asthma,Chronic respiratory diseases,0.0,-10.0,Negative
I got so sick last week I don t know whether it was my gall bladder or my husband poisoned me my aunt,Gall bladder,Digestive diseases (except cirrhosis),0.0,-10.0,Negative
I had 2 get mine removed I feel for u so much I m sending good pure lesion vices to or EVIL straight gall bladder,Gall bladder,Digestive diseases (except cirrhosis),0.0,20.0,Positive
I had another gall bladder attack and mamma needs to get it removed ASAP I am in pain,Gall bladder,Digestive diseases (except cirrhosis),0.0,0.0,Neutral
I Had Asthma for 12 Years Until I Round But It Was Cancer conscioushealthsolutions health,Asthma,Chronic respiratory diseases,0.0,0.0,Neutral
I had severe pancreatitis and had to have mine out Feel great now no side effects All the best to her for morrow,Pancreatitis,Digestive diseases (except cirrhosis),0.0,-20.0,Negative
I had to officially report today that not one female driven media outlet has lined up stories for January for cervical cancer awareness,Cervical cancer,Neoplasms,0.0,10.0,Positive
I hate being sick bc I start having asthma attacks and they aren t so grm,Asthma,Chronic respiratory diseases,0.0,-10.0,Negative
I have a fucking migrate I wish I could kill myself,Migraine,Neurological disorders,0.0,-10.0,Negative
I have a migrate They relieve my headache,Migraine,Neurological disorders,0.0,0.0,Neutral
I have a really bad migrate,Migraine,Neurological disorders,0.0,0.0,Neutral
I have a splinter haemorrhage and all I thought about is how it s a symptom that I may have bacterial endocarditis,Endocarditis,Cardiovascular and circulatory diseases,0.0,-10.0,Negative
i have asthma so I dont smoke,Asthma,Chronic respiratory diseases,0.0,0.0,Neutral
I have asthma you know how to fix that BREATHE dad stop building Valley oh my god,Asthma,Chronic respiratory diseases,0.0,10.0,Positive
I have been living with type 1 diabetes for more than 25 years Diabetes Type,Diabetes,"Diabetes, urogenital, blood, and endocrine diseases",0.0,0.0,Neutral
I have epilepsy you know that,Epilepsy,Neurological disorders,0.0,0.0,Neutral
i have serious asthma i am dying of it and i will suck a cock i am joking asthma patients are gay,Asthma,Chronic respiratory diseases,0.0,-10.0,Negative
I have the worse migrate and I have so much packing cleaning and organizing to do before Monday,Migraine,Neurological disorders,0.0,-10.0,Negative
I have trial fibrillation and supraventricular tachycardia Heartbeat goes up to 230bpm sometimes makes me feel shocking,Atrial fibrillation,Cardiovascular and circulatory diseases,0.0,0.0,Neutral
I have type one diabetes and stage one kidney disease Am I a good candidate for a BBL,kidney disease,"Diabetes, urogenital, blood, and endocrine diseases",0.0,10.0,Positive
I He ARE NOW in CANADA Of any CANADIAN is suffering from ulcerative politics River Cancer Diabetes or any other,Liver cancer,Neoplasms,0.0,-10.0,Negative
I held my mother in my arms the moment she died from smoking related lung cancer Worst moment of my life ENCOURAGE HIM to stop,lung cancer,Neoplasms,0.0,0.0,Neutral
I Helped By Life Sick Cancer s Butt breast cancer survivor walk,Breast cancer,Neoplasms,0.0,10.0,Positive
I hope you do it pancreatic cancer will hit you in two weeks you did this to yourself maggot,Pancreatic cancer,Neoplasms,0.0,10.0,Positive
I hope you don t get liver cancer ah,Liver cancer,Neoplasms,0.0,10.0,Positive
I hope you wake up with pancreatic cancer,Pancreatic cancer,Neoplasms,0.0,10.0,Positive
I hope your father gets news that he has liver cancer,Liver cancer,Neoplasms,0.0,10.0,Positive
I just called my brother a p word with asthma,Asthma,Chronic respiratory diseases,0.0,0.0,Neutral
I just developed a new fun type of pain that could be pancreatitis Boy,Pancreatitis,Digestive diseases (except cirrhosis),0.0,0.0,Neutral
I just donate to The Leukaemia amp Lymphoma Society Help patients with blood cancer live better longer lives Visit,Leukemia,Neoplasms,0.0,10.0,Positive
I just read a case study in a THC induced pancreatitis Pancreatitis is serious can be life threatening,Pancreatitis,Digestive diseases (except cirrhosis),0.0,10.0,Positive
I just sneered 6 times in a row and now I m getting a migrate ll,Migraine,Neurological disorders,0.0,0.0,Neutral
I just think it s really unfair how Pancreatic Cancer gets their own month for awareness Y don t i have my own month Equality please,Pancreatic cancer,Neoplasms,0.0,10.0,Positive
I just unloaded Ask Aorta Episode 7 Kidney Disease Part 5 English to,kidney disease,"Diabetes, urogenital, blood, and endocrine diseases",0.0,0.0,Neutral
I just wished for a cheque for the leukaemia foundation with Menulog DishesGetWishes,Leukemia,Neoplasms,0.0,0.0,Neutral
I kept coughing I m thankful for not having asthma,Asthma,Chronic respiratory diseases,0.0,0.0,Neutral
I know someone close to me with liver cancer who had many of these signs especially the pain in the right side,Liver cancer,Neoplasms,0.0,-20.0,Negative
I like to end any invite to my home with You ve gotten your tuberculosis vaccine right,Tuberculosis,HIV/AIDS and tuberculosis,0.0,20.0,Positive
I liked a video from Gene Treatment Cures Terminally All Girl with Leukaemia ft Nina Darling,Leukemia,Neoplasms,0.0,20.0,Positive
I liked a video from Loose Using His Music To Open Up About His Kidney Cancer Met,Kidney cancer,Neoplasms,0.0,0.0,Neutral
I live in of and have one Them session left for killing my Ovarian cancer,Ovarian cancer,Neoplasms,0.0,0.0,Neutral
I Loss He have an amazing group on of for pancreatitis sufferer Feel free to come and join us,Pancreatitis,Digestive diseases (except cirrhosis),0.0,10.0,Positive
I lost my sum and grand to lung cancer sum smoked ran didn t ii don t but I question if we re predisposed to certain cancers,lung cancer,Neoplasms,0.0,-10.0,Negative
I love my mamma for y all who don t then you might as well kill to self cut she could ve got a abortion remember that,Abortion,Maternal disorders,0.0,0.0,Neutral
I Love Someone With Cancer Breast Cancer Awareness Pink Ribbon Bottle Cap Intractable Feel of Badge Older via,Breast cancer,Neoplasms,0.0,20.0,Positive
I m 1 year breastcancer free today of in support of getting better care for Nova Scotians,Breast cancer,Neoplasms,0.0,20.0,Positive
I m a lazy piece of poor I don t have asthma ll,Asthma,Chronic respiratory diseases,0.0,-10.0,Negative
I m a Survivor of pancreaticcancer says the disease doesn t have to be a death sentence back,Pancreatic cancer,Neoplasms,0.0,0.0,Neutral
I m having a god damn asthma attack amp it s a lot worse now that I m 24 amp not 8,Asthma,Chronic respiratory diseases,0.0,-10.0,Negative
I m having an asthma attack cut of Rico and Tell,Asthma,Chronic respiratory diseases,0.0,0.0,Neutral
I m not chasing you no more I got asthma,Asthma,Chronic respiratory diseases,0.0,0.0,Neutral
I m not sure my pancreas or my gall bladder have forgiven me yet I looked up the grm timetable for tomorrow,Gall bladder,Digestive diseases (except cirrhosis),0.0,0.0,Neutral
I m raising money for Open Heart Surgery Aortic Aneurysm Click to Donate via,Aortic aneurysm,Cardiovascular and circulatory diseases,0.0,0.0,Neutral
I m reading His is not good news for all Armies Must diagnosed with 4 4 Abdominal Aortic Aneurysm lymekills,Aortic aneurysm,Cardiovascular and circulatory diseases,0.0,0.0,Neutral
I m really just sitting here in amazement that my anna survived lung cancer TWICE,lung cancer,Neoplasms,0.0,0.0,Neutral
I m sorry but It looks like you have tuberculosis,Tuberculosis,HIV/AIDS and tuberculosis,0.0,-10.0,Negative
I m spending my Saturday night reading an article entitled Dusting 5 Baths about Asthma You can t handle popularity I can,Asthma,Chronic respiratory diseases,0.0,0.0,Neutral
I m sure he s got asthma pump define amp amos on stand He might even have Radium by the bucket,Asthma,Chronic respiratory diseases,0.0,0.0,Neutral
I need huge today He just put one of our cats down River cancer RIP Snickers 15 amp a half years wasn t enough,Liver cancer,Neoplasms,0.0,10.0,Positive
I need someone that will make me laugh and make my trial fibrillation happen g 123,Atrial fibrillation,Cardiovascular and circulatory diseases,0.0,20.0,Positive
I need to get the appointment for the tuberculosis blood test on monday,Tuberculosis,HIV/AIDS and tuberculosis,0.0,0.0,Neutral
I Now Key on FirstName Cases It You down da Abortion spot,Abortion,Maternal disorders,0.0,0.0,Neutral
I only know Aloe Vera is good for burnt skin and papa for septic ulcer the 4 into,Peptic ulcer,Digestive diseases (except cirrhosis),0.0,10.0,Positive
I pay 1200 a month amp have it for emergencies had pancreatitis amp gallbladder removed but I m not a dr runner,Pancreatitis,Digestive diseases (except cirrhosis),0.0,10.0,Positive
I please do you know anyone doing works on ovarian cancer By friend has a dilemma with her work,Ovarian cancer,Neoplasms,0.0,0.0,Neutral
I put the dress back on the rack I m rattling a seizure epilepsy and a syndrome but I still have a dream,Epilepsy,Neurological disorders,0.0,-10.0,Negative
I retained about 25 litre of fluid cardiomyopathy but soon got rid of it Now I have returned to full health,Cardiomyopathy,Cardiovascular and circulatory diseases,0.0,0.0,Neutral
I said to Right my cousin Ernest died in Sov His DOB was Aug10th I shook my head I told Right their Tom died from breast cancer he was 8,Breast cancer,Neoplasms,0.0,-20.0,Negative
I still can t figure out how people can be cashier I would panic and have an asthma attack,Asthma,Chronic respiratory diseases,0.0,0.0,Neutral
I Talk For By SISTER via breast cancer survivor walk,Breast cancer,Neoplasms,0.0,10.0,Positive
I think I caught asthma I was doing a really intense sport Running,Asthma,Chronic respiratory diseases,0.0,0.0,Neutral
I think I m just being extra mean to smokers because I suffer from asthma and like a tiny bit of smoke will fuck me up ll,Asthma,Chronic respiratory diseases,0.0,-20.0,Negative
I think I m sick Oh I Hyperthropic CardioMyopathy killingmesoftly,Cardiomyopathy,Cardiovascular and circulatory diseases,0.0,-10.0,Negative
I think id have a dilated cardiomyopathy be of won,Cardiomyopathy,Cardiovascular and circulatory diseases,0.0,0.0,Neutral
I think poverty is far better than HIV aids,HIV/AIDS,HIV/AIDS and tuberculosis,0.0,20.0,Positive
I ve had a migrate all day,Migraine,Neurological disorders,0.0,0.0,Neutral
i want to live inside dongwoo s gall bladder,Gall bladder,Digestive diseases (except cirrhosis),0.0,0.0,Neutral
I was honoured to be asked to share Had s story by The Over Nahmani Pancreatic Cancer Foundation in the Old,Pancreatic cancer,Neoplasms,0.0,0.0,Neutral
I was in pain from gallstones and the infected gall bladder was infecting my liver I am much better,Gall bladder,Digestive diseases (except cirrhosis),0.0,0.0,Neutral
I went amp visited my mother at the nursing home today early onset Alzheimer s amp she thought I was my dad the whole time I was there,Alzheimer,Neurological disorders,0.0,10.0,Positive
I will eventually migrate,Migraine,Neurological disorders,0.0,0.0,Neutral
I will not die not from HIV AIDS CANCER MALARIA ACCIDENT of NATURAL CAUSES But for asking Demyan tax papers EuroBond money,HIV/AIDS,HIV/AIDS and tuberculosis,0.0,-10.0,Negative
I wish I m waiting to hear if my hubs is having a recurrence of pancreatic cancer,Pancreatic cancer,Neoplasms,0.0,10.0,Positive
I wonder about people who go to Mimi s Of The concept and alliance are based on an opera character who dies of tuberculosis,Tuberculosis,HIV/AIDS and tuberculosis,0.0,-10.0,Negative
i would to lose weight before i go to New Work in spring time this year and before i go back to my diabetes doctor next month,Diabetes,"Diabetes, urogenital, blood, and endocrine diseases",0.0,0.0,Neutral
I would ve had a asthma attack right then amp there,Asthma,Chronic respiratory diseases,0.0,0.0,Neutral
I4U News Stress may Trigger Alzheimer s Disease in Elderly I4U News Stress contributes to many health problems,Alzheimer,Neurological disorders,0.0,-20.0,Negative
ICYMI educational webinars on a variety of topics to aide in the prostate cancer journey,Prostate cancer,Neoplasms,0.0,0.0,Neutral
ICYMI HIV positive doctor who helped AIDS patients couldn t heal himself To he got a dog that did long,HIV/AIDS,HIV/AIDS and tuberculosis,0.0,20.0,Positive
ICYMI Now animals can give you tuberculosis,Tuberculosis,HIV/AIDS and tuberculosis,0.0,0.0,Neutral
ICYMI Tuberculosis in London Annual review Public Health England up 2015,Tuberculosis,HIV/AIDS and tuberculosis,0.0,0.0,Neutral
ICYMI Weather Draws Cockroaches Indoors Increasing Risk for Allergens amp Asthma Attacks asthma printing,Asthma,Chronic respiratory diseases,0.0,-10.0,Negative
Identification of barrier that prevents progression of benign kidney tumours to malignant disease,kidney disease,"Diabetes, urogenital, blood, and endocrine diseases",0.0,0.0,Neutral
if you would like to file a complaint against your employer please read the following as well,Diabetes,"Diabetes, urogenital, blood, and endocrine diseases",0.0,0.0,Neutral
Immune Well Regulation to Great Prostate Cancer,Prostate cancer,Neoplasms,0.0,0.0,Neutral
Immunotherapy Medicine better than Chemotherapy in treating Hung Cancer I4U News,lung cancer,Neoplasms,0.0,10.0,Positive
Impalpable Apex Seat COPD C Chronic destructive pulmonary disease O Obesity P Pleural effusion Or Pericardial effusion D Dextrocardia,COPD,Chronic respiratory diseases,0.0,-20.0,Negative
Improve Diabetic Kidney Disease,kidney disease,"Diabetes, urogenital, blood, and endocrine diseases",0.0,10.0,Positive
Improve Diabetic Kidney Disease Learn the diabetic nephropathy treatment and diet to improve kidney function,kidney disease,"Diabetes, urogenital, blood, and endocrine diseases",0.0,30.0,Positive
In a surprise to nobody I m abnormal It least my gall bladder is To good times coming,Gall bladder,Digestive diseases (except cirrhosis),0.0,10.0,Positive
In auscultation trial fibrillation sounds chronic like shoes in washing machine veterinary vetFOAMed vetstudent,Atrial fibrillation,Cardiovascular and circulatory diseases,0.0,0.0,Neutral
In case you missed it,Cardiomyopathy,Cardiovascular and circulatory diseases,0.0,0.0,Neutral
In children acute lymphoblastic leukaemia and BrainTumors are most common except in Africa where non Hodgkin lympho occurs more often,Non-Hodgkin lymphoma,Neoplasms,0.0,-10.0,Negative
In Diabetes Emergencies His Nasal Pray Right Work,Diabetes,"Diabetes, urogenital, blood, and endocrine diseases",0.0,0.0,Neutral
In keeping with our theme of memory here s a talk about a rather sad ending for so many people Alzheimer s,Alzheimer,Neurological disorders,0.0,0.0,Neutral
In later stages of prostate cancer it can cause difficulty printing blood in the urine or pain in the pelvis back or when printing,Prostate cancer,Neoplasms,0.0,-20.0,Negative
In most cases an ruptured abdominal aortic aneurysm AAA will cause no symptoms,Aortic aneurysm,Cardiovascular and circulatory diseases,0.0,-10.0,Negative
In my 20 years of health care I ve never seen an of GYN offer an abortion option to a 24 week emergency c section,Abortion,Maternal disorders,0.0,0.0,Neutral
In my way to get my last round of them for non Hodgkin s large B cell Lymphoma May livetweetinglymphoma cancer,Non-Hodgkin lymphoma,Neoplasms,0.0,0.0,Neutral
In Open Letter To The NFL Why He Want Neglect Prostate Cancer conscioushealthsolutions health,Prostate cancer,Neoplasms,0.0,0.0,Neutral
In response to s pledge to find a cure for Alzheimer s doubles down on his goal of curing chlamydia,Alzheimer,Neurological disorders,0.0,10.0,Positive
in so going to take driving class as soon as possible so that I can drive by myself to host when asthma is attacking me at midnight,Asthma,Chronic respiratory diseases,0.0,0.0,Neutral
in so passed that began s cat got checked for leukaemia like utf,Leukemia,Neoplasms,0.0,-10.0,Negative
In the News The highest rates of bovine of cases in the United States are found along the U S Mexican border,Tuberculosis,HIV/AIDS and tuberculosis,0.0,0.0,Neutral
In the third DayofAdvocacy Well Them gave to me Three statistics about cervical cancer and the HPV vaccine,Cervical cancer,Neoplasms,0.0,10.0,Positive
In this day in 1974 one of the true tetanus of both bedtime radio amp of Back Penny died of pancreatic cancer at age 80,Pancreatic cancer,Neoplasms,0.0,-10.0,Negative
In this video I talk about Asthma Acids amp Cholestrol,Asthma,Chronic respiratory diseases,0.0,0.0,Neutral
In Trial Flutter in a It w Titus Versus the Trial Twitch and Interruption of the IVC,Atrial flutter,Cardiovascular and circulatory diseases,0.0,0.0,Neutral
in ville Appreciate your asking Waiting to go home ALL good I guess I m a grandfather to a new bounding baby gall bladder,Gall bladder,Digestive diseases (except cirrhosis),0.0,10.0,Positive
In with Sov 2015 Alliance Hospital Abuja became the first hospital in Siberia to perform a complex open heart surgery for aortic aneurysm,Aortic aneurysm,Cardiovascular and circulatory diseases,0.0,0.0,Neutral
Incidence of bone pain in patients with breast cancer treated with lipegfilgrastim or pegfilgrastim an integrated,Breast cancer,Neoplasms,0.0,-10.0,Negative
Incidence Of Hung Cancer In Black Men Is Higher Than The National Average,lung cancer,Neoplasms,0.0,0.0,Neutral
