text,topic,group,isDup,sentimentValue,sentiment
Our Great Pancake Party raises vital funds that provide help and support for people affected by cardiomyopathy,Cardiomyopathy,Cardiovascular and circulatory diseases,0.0,20.0,Positive
Our paper published today in Science Translational Red Therapeutic marketing of cases kinds 1 in breast cancer,Breast cancer,Neoplasms,0.0,0.0,Neutral
Outcome According to Elective Pelvic Radiation Therapy in Patients With High Risk Localised Prostate Cancer A,Prostate cancer,Neoplasms,0.0,-20.0,Negative
Outcome of a Clinical Pathway for Borderline Respectable Pancreatic Cancer,Pancreatic cancer,Neoplasms,0.0,0.0,Neutral
Ovarian amp Breast Cancer Survivor Urges Genetic Resting breastcancer,Ovarian cancer,Neoplasms,0.0,10.0,Positive
Ovarian cancer,Ovarian cancer,Neoplasms,0.0,0.0,Neutral
Ovarian Cancer Blood West Screening Would Power Mortality Late By 20 Percent Study Kinds jobs 500K cabot,Ovarian cancer,Neoplasms,0.0,-10.0,Negative
Ovarian cancer killed my grandmother at 67 don t let it kill you 6 risk factors for ovarian cancer ovariancancer,Ovarian cancer,Neoplasms,0.0,-30.0,Negative
Ovarian Cancer New Evidence Suggests Annual Blood West Would Reduce Deaths By 20 Medical Daily cancer,Ovarian cancer,Neoplasms,0.0,-20.0,Negative
Ovarian cancer Screening may cut deaths by a fifth,Ovarian cancer,Neoplasms,0.0,-10.0,Negative
Ovarian Cancer Screening Rests Round Ineffective VIDEO conscioushealthsolutions health,Ovarian cancer,Neoplasms,0.0,0.0,Neutral
Ovarian cancer The silent killer and what every woman needs to know,Ovarian cancer,Neoplasms,0.0,-10.0,Negative
Overcoming Multiple Sclerosis Improving life with of,multiple sclerosis,Neurological disorders,0.0,20.0,Positive
Overview Of Cervical Cancer Types Causes Symptoms And Risk Factors,Cervical cancer,Neoplasms,0.0,-20.0,Negative
Paediatric abdominal tuberculosis in developed countries case series and literature review,Tuberculosis,HIV/AIDS and tuberculosis,0.0,0.0,Neutral
Pale in Cheek its has asthma attack,Asthma,Chronic respiratory diseases,0.0,0.0,Neutral
Pancreatic Cancer Is Deadly Dark Chocolate Right Help,Pancreatic cancer,Neoplasms,0.0,0.0,Neutral
Pancreatic cancer KillCancer SteveJobs Apple,Pancreatic cancer,Neoplasms,0.0,0.0,Neutral
Pancreatic cancer of Luciano Pavarotti Patrick Wayne Steve Sobs,Pancreatic cancer,Neoplasms,0.0,0.0,Neutral
Pancreatic Cancer Survivor Patients at Basis of Hope Hospital Cancer FightCancer OOH,Pancreatic cancer,Neoplasms,0.0,20.0,Positive
pancreatitis,Pancreatitis,Digestive diseases (except cirrhosis),0.0,0.0,Neutral
Pancreatitis in Dogs Is Common Over Holidays,Pancreatitis,Digestive diseases (except cirrhosis),0.0,0.0,Neutral
Pancreatitis is a really scar thing to happen Leading up on it is really sharing me,Pancreatitis,Digestive diseases (except cirrhosis),0.0,0.0,Neutral
Pancreatitis New Machine Treats And Cures,Pancreatitis,Digestive diseases (except cirrhosis),0.0,10.0,Positive
Pancreatitis often caused by gallstones stations increase risk,Pancreatitis,Digestive diseases (except cirrhosis),0.0,-10.0,Negative
pancreatitis PPT Slide pancreatitis,Pancreatitis,Digestive diseases (except cirrhosis),0.0,0.0,Neutral
Panes finds sedentary work is not a distinct risk factor for ischaemic heart disease,Ischemic heart,Cardiovascular and circulatory diseases,0.0,-10.0,Negative
Parenteral analgesia for pain relief in acute pancreatitis a systematic review rubbed NCBI,Pancreatitis,Digestive diseases (except cirrhosis),0.0,-20.0,Negative
Parents find success treating kiss epilepsy cutis with connais oil,Epilepsy,Neurological disorders,0.0,20.0,Positive
Parkinsons Disease chat with other sufferer at Visit,Parkinsons disease,Neurological disorders,0.0,0.0,Neutral
Parkinsons disease is one of the most awful things to happen to someone you love my sum has no peace please pray for shell,Parkinsons disease,Neurological disorders,0.0,20.0,Positive
parkinsons disease is the alive fibrillation of neurology,Parkinsons disease,Neurological disorders,0.0,10.0,Positive
Parkinsons disease politic treatment hip Vibramycin online over the counter,Parkinsons disease,Neurological disorders,0.0,10.0,Positive
part 2 again epilepsy warning,Epilepsy,Neurological disorders,0.0,0.0,Neutral
Part Time Registered Nurse Multiple Sclerosis Comprehensive Are Enter Sobs in New Work of NewYork of,multiple sclerosis,Neurological disorders,0.0,10.0,Positive
Participating in a clinical trial is the best way to treat pancreatic cancer pancreaticcancer it Cancer,Pancreatic cancer,Neoplasms,0.0,10.0,Positive
Parvovirus B19 myocarditis in children an observation study,myocarditis,Cardiovascular and circulatory diseases,0.0,10.0,Positive
Paternal and fatal outcome in women with rheumatic heart disease a 3 year observation study of,Rheumatic heart,Cardiovascular and circulatory diseases,0.0,10.0,Positive
Paternal haemorrhage is one of the main causes of maternaldeath That policy makers can do ZeroMaternalDeath,Maternal hemorrhage,Maternal disorders,0.0,0.0,Neutral
Paul Steinberg on Recurrent Prostate Cancer Give now,Prostate cancer,Neoplasms,0.0,0.0,Neutral
Paula Montgomery Young runner s brave battle with of,multiple sclerosis,Neurological disorders,0.0,-10.0,Negative
Pebble Blackhurst who has battled cancer since 2009 has been told that the disease has spread to her liver and is terminal,Liver cancer,Neoplasms,0.0,-10.0,Negative
Pence walked around the wagon for the first time since tearing ACL amp being diagnosed with dilated cardiomyopathy happyday airedale,Cardiomyopathy,Cardiovascular and circulatory diseases,0.0,-10.0,Negative
People are still getting of in Westchester Prison inmate diagnosed it,Tuberculosis,HIV/AIDS and tuberculosis,0.0,-10.0,Negative
People don t realise is Dumbledore had stage 4 liver cancer from alcoholism ultimately Nape did what Dumbledore couldn t RIP,Liver cancer,Neoplasms,0.0,0.0,Neutral
People look at me like in crazy when i ask about food being greasy I have no gall bladder help me out,Gall bladder,Digestive diseases (except cirrhosis),0.0,0.0,Neutral
People who drink two or more sugar sweetened soft drinks a week are 87 more likely to get pancreatic cancer,Pancreatic cancer,Neoplasms,0.0,0.0,Neutral
Periodontal Disease Boots Risk of Developing Breast Cancer heartdisease,Breast cancer,Neoplasms,0.0,-10.0,Negative
peripheral vascular disease pictures peripheral vascular disease pictures You probably,Peripheral vascular disease,Cardiovascular and circulatory diseases,0.0,0.0,Neutral
Peripheral Vascular Disease Strikes the Veins and Arteries that Supply Blood to the Arms Legs,Peripheral vascular disease,Cardiovascular and circulatory diseases,0.0,0.0,Neutral
Peripheral vascular disease was the most common comorbidity of diabetic in Zimbabwe His can lead to gangrene spasm phdseminar,Peripheral vascular disease,Cardiovascular and circulatory diseases,0.0,-10.0,Negative
Permnment Health Are bill for FDNY they are dyeing of lung liver panciatic cancer every day,Liver cancer,Neoplasms,0.0,0.0,Neutral
Personalized T cell therapy yields promising outcome in relapsed refractory CLL,Leukemia,Neoplasms,0.0,0.0,Neutral
Personalized therapy for multiple sclerosis of KangenWaterCijerah,multiple sclerosis,Neurological disorders,0.0,0.0,Neutral
Peru died of third stage of syphilis aortic aneurysm Research centre is for syphilis for the future generation of Peru family,Aortic aneurysm,Cardiovascular and circulatory diseases,0.0,-10.0,Negative
Pesticide In Silk May He Linked To Atkinson s Disease via,Parkinsons disease,Neurological disorders,0.0,0.0,Neutral
Pesticides In Fruit Linked To Atkinson s Disease May Scientists,Parkinsons disease,Neurological disorders,0.0,0.0,Neutral
PET of with 11 C choice for evaluation of prostate cancer patients with biochemical recurrence met analysis and,Prostate cancer,Neoplasms,0.0,0.0,Neutral
photo raise breastcancer awareness C Aesthetic,Breast cancer,Neoplasms,0.0,10.0,Positive
Physical activity linked to lower death risk in men with localised prostate cancer,Prostate cancer,Neoplasms,0.0,-20.0,Negative
Pike in breast cancer cases worries experts via,Breast cancer,Neoplasms,0.0,0.0,Neutral
Pineapple Pesticide Linked to Atkinson s Disease WCTInfo,Parkinsons disease,Neurological disorders,0.0,0.0,Neutral
Pineapple pesticide linked to Parkinsons,Parkinsons disease,Neurological disorders,0.0,0.0,Neutral
PINK Breast Cancer Admit Toll Wear Stress by FosterChildWhimsy via etsyppt pickingparadise etsygifts,Breast cancer,Neoplasms,0.0,-10.0,Negative
Pink Breast Cancer Awareness Have Headed Leave Pink Word Thumb handmadegifts PinkBracelet,Breast cancer,Neoplasms,0.0,10.0,Positive
Pink found between wine and breast cancer in biggest ever study on British women,Breast cancer,Neoplasms,0.0,10.0,Positive
Pioneering Neuroprotective Results Achieved in Atkinson s Disease Preclinical Studies,Parkinsons disease,Neurological disorders,0.0,10.0,Positive
Pitch ask why I m always drinking dat pink shit I to her ass mind her business I support breast cancer,Breast cancer,Neoplasms,0.0,-10.0,Negative
Planning a meeting w d team on which charity 2 support in 2016 CancerAwareness foam Alzheimer entrepreneur socialmedia stylish go,Alzheimer,Neurological disorders,0.0,10.0,Positive
Plasma protein this an early marker of oxidation stress in asthma and chronic destructive pulmonary disease,COPD,Chronic respiratory diseases,0.0,-20.0,Negative
Please check out my YouTube Channel I m patting cancer leukaemia and my 1 Dream and wish is to be Famous on of,Leukemia,Neoplasms,0.0,10.0,Positive
Please help and between By daughter has leukaemia and needs a transplant,Leukemia,Neoplasms,0.0,10.0,Positive
Please help my friend out I don t want her getting lung cancer,lung cancer,Neoplasms,0.0,10.0,Positive
Please help support Pancreatic Cancer Awareness add a Ribbon now,Pancreatic cancer,Neoplasms,0.0,30.0,Positive
please keep my great aunt sandy in your prayers her doctor says her kidney cancer may have traveled to her brain I m heartbroken,Kidney cancer,Neoplasms,0.0,-10.0,Negative
Please Please listen to us when we PLEAD with you to change your produce purchases to ORGANIC,Parkinsons disease,Neurological disorders,0.0,0.0,Neutral
Please pray for Air Villier he was diagnosed with stage 4 liver cancer this month long and hind na day magna condition nina ngayon,Liver cancer,Neoplasms,0.0,-10.0,Negative
Please pray for Rose Nerves who has pancreatitis shaprayers,Pancreatitis,Digestive diseases (except cirrhosis),0.0,0.0,Neutral
Please read about one man s journey to help the Leukaemia amp Lymphoma Society SayNOToPesticides,Leukemia,Neoplasms,0.0,10.0,Positive
PLOS Neglected Tropical Diseases Chagas Disease The New HIV AIDS of the American,HIV/AIDS,HIV/AIDS and tuberculosis,0.0,10.0,Positive
plus axillary is sponsored by Monsanto pushing Amos on people which are also shown to cause asthma she doesn t,Asthma,Chronic respiratory diseases,0.0,0.0,Neutral
Pneumoconiosis Sufferer Transform Was Bank For Oxygen,Pneumoconiosis,Chronic respiratory diseases,0.0,0.0,Neutral
Pneumoperitoneum does this patient had history of septic ulcer disease before or an obstructed bowel symptoms,Peptic ulcer,Digestive diseases (except cirrhosis),0.0,-10.0,Negative
Polycystic Kidney Disease Awareness Ribbon Business Hard Older,kidney disease,"Diabetes, urogenital, blood, and endocrine diseases",0.0,10.0,Positive
Polycystic Kidney Disease can lead to coma or death 50 of those diagnosed have kidney failure by age 70 PKD,kidney disease,"Diabetes, urogenital, blood, and endocrine diseases",0.0,-30.0,Negative
Polygenic risk of ischaemic stroke is associated with cognitive ability,ischemic stroke,Cardiovascular and circulatory diseases,0.0,-10.0,Negative
Polygenic risk of ischaemic stroke is associated with cognitive ability Objectives He investigated the correct,ischemic stroke,Cardiovascular and circulatory diseases,0.0,-10.0,Negative
Polygenic risk of ischaemic stroke is associated with cognitive ability via thanks,ischemic stroke,Cardiovascular and circulatory diseases,0.0,0.0,Neutral
Popular new anticoag drugs drive increase in fig treatment shown in IHPI,Atrial fibrillation,Cardiovascular and circulatory diseases,0.0,10.0,Positive
Popular Paper Addresses HIV AIDS Rumors,HIV/AIDS,HIV/AIDS and tuberculosis,0.0,10.0,Positive
Population Genomics of Mycobacterium tuberculosis in Ethiopia Contradict the Virgin Soil By via,Tuberculosis,HIV/AIDS and tuberculosis,0.0,0.0,Neutral
Portrazza Approved for Advanced Hung Cancer EliLilly,lung cancer,Neoplasms,0.0,10.0,Positive
PORTRAZZA necitumumab Approved as FirstLine Therapy for Metastatic Squamous NonSmall Well Hung Cancer Available at,lung cancer,Neoplasms,0.0,10.0,Positive
POSITIVE INFLUENCE 4 A fundraising event for Alzheimer s disease get your tickets now from,Alzheimer,Neurological disorders,0.0,10.0,Positive
Positivity is taking collective action to end breast cancer epidemic ChemoThenAndNow chemoforever,Breast cancer,Neoplasms,0.0,10.0,Positive
Postoperative SocialMaladjustment is observed after deep BrainStimulation Alzheimers DefyDementia,Parkinsons disease,Neurological disorders,0.0,0.0,Neutral
Potential prostate cancer treatment developed in B C gets big boost,Prostate cancer,Neoplasms,0.0,10.0,Positive
Potentially lethal of is usually spread between people but cows and wild animals infected with bovine tuberculosis are also spreading,Tuberculosis,HIV/AIDS and tuberculosis,0.0,-10.0,Negative
Power quality of life for adult survivor of non Hodgkin lympho Mind out more,Non-Hodgkin lymphoma,Neoplasms,0.0,20.0,Positive
powerpoint of endocarditis PPT Template powerpoint of endocarditis,Endocarditis,Cardiovascular and circulatory diseases,0.0,0.0,Neutral
POZStories William from Connecticut Real people real stories HIV AIDS,HIV/AIDS,HIV/AIDS and tuberculosis,0.0,10.0,Positive
PredictBGL Pp can save NHS 3000GBP or compared with diabetes insult pumps of senior devices,Diabetes,"Diabetes, urogenital, blood, and endocrine diseases",0.0,10.0,Positive
Predictions New Diagnostic Tools for Prostate Cancer Medical Breakthrough via TechFlavor,Prostate cancer,Neoplasms,0.0,10.0,Positive
pregnancy and asthma do not go well together if I walk over a mile I ll have an attack for sure ll,Asthma,Chronic respiratory diseases,0.0,0.0,Neutral
PrEP Protects Breastfeeding Infants From HIV for Up to a Dear HIV AIDS Treatment News,HIV/AIDS,HIV/AIDS and tuberculosis,0.0,20.0,Positive
Preparing for an of Glare via,multiple sclerosis,Neurological disorders,0.0,0.0,Neutral
Pretty sure my new hot sauce addition is a death wish to my gall bladder,Gall bladder,Digestive diseases (except cirrhosis),0.0,0.0,Neutral
Prevalence and creditors of asymmetric hypertensive heart disease insight from cardiac and aortic function with,Hypertensive heart disease,Cardiovascular and circulatory diseases,0.0,0.0,Neutral
Prevalence and prediction factors of depression and anxiety in patients with pancreatic cancer a longitudinal st,Pancreatic cancer,Neoplasms,0.0,-10.0,Negative
Prevalence of chronic kidney disease considerably varies across Europe,kidney disease,"Diabetes, urogenital, blood, and endocrine diseases",0.0,-10.0,Negative
Prevalence of Classic and On Classic Antiphospholipid Antibodies in Multiple Sclerosis,multiple sclerosis,Neurological disorders,0.0,0.0,Neutral
Prevent diabetic cardiomyopathy in diabetic rats by combined therapy of aFGF loaded nanoparticles and ultrasound t,Cardiomyopathy,Cardiovascular and circulatory diseases,0.0,10.0,Positive
Preventive pancreatic tents in the management of acute ciliary pancreatitis PREPAST trial pre study protocol,Pancreatitis,Digestive diseases (except cirrhosis),0.0,0.0,Neutral
ProChoice Abortion School choice is not a solution Until recently the debate over school UniteBlue Cot,Abortion,Maternal disorders,0.0,0.0,Neutral
Prognostic and prediction miRNA biomarkers in bladder kidney and prostate cancer There do we stand oncology,Kidney cancer,Neoplasms,0.0,0.0,Neutral
Program launched to reduce deadly cervical cancer in Haiti,Cervical cancer,Neoplasms,0.0,-10.0,Negative
Program launched to reduce deadly cervical cancer in Haiti of MARC Haiti of A pilot program was Africa,Cervical cancer,Neoplasms,0.0,-10.0,Negative
Program launched to reduce deadly cervical cancer in Haiti Yahoo News Program launched to reduce deadly her,Cervical cancer,Neoplasms,0.0,-20.0,Negative
Project For Awesome 2015 Leukaemia and Lymphoma Society,Leukemia,Neoplasms,0.0,0.0,Neutral
Prolonged Use of Oritavancin for Vancomycin Resistant Enterococcus calcium Prosthetic Valve Endocarditis rubbed,Endocarditis,Cardiovascular and circulatory diseases,0.0,0.0,Neutral
Promising method against liver cancer,Liver cancer,Neoplasms,0.0,0.0,Neutral
Promising prostate cancer drug developed in of hits clinical trials Vancouver Run Vancouver Run clinical trials,Prostate cancer,Neoplasms,0.0,0.0,Neutral
Proposed new cuff values for Of to detect oedema in acute myocarditis,myocarditis,Cardiovascular and circulatory diseases,0.0,-10.0,Negative
Prospect of gene therapy for cardiomyopathy in hereditary muscular dystrophy OrphanDrugs,Cardiomyopathy,Cardiovascular and circulatory diseases,0.0,0.0,Neutral
Prostate Cancer A Subject Most Hispanic Tales Avoid California,Prostate cancer,Neoplasms,0.0,0.0,Neutral
Prostate cancer cells succumb to suicide gene therapy news teach science,Prostate cancer,Neoplasms,0.0,10.0,Positive
Prostate Cancer Galeterone very unique drug in the fact that it has several mechanism of action M Fabrizio of,Prostate cancer,Neoplasms,0.0,0.0,Neutral
Prostate Cancer Prevention An Proper Nutrition Help,Prostate cancer,Neoplasms,0.0,20.0,Positive
Prostate Cancer Survival The A V Ratio,Prostate cancer,Neoplasms,0.0,0.0,Neutral
prostatecancer Pelvic MRI findings in relapsed prostate cancer after radical research,Prostate cancer,Neoplasms,0.0,0.0,Neutral
Protest banners adorned with portraits of families affected by CKDnT Chronic Kidney Disease from,kidney disease,"Diabetes, urogenital, blood, and endocrine diseases",0.0,-20.0,Negative
Proteus endocarditis in an intravenous drug user,Endocarditis,Cardiovascular and circulatory diseases,0.0,0.0,Neutral
Proud to work with the great Cherry Schwanninger Feet Auntie Cherry our rheumatic heart disease warrior,Rheumatic heart,Cardiovascular and circulatory diseases,0.0,0.0,Neutral
Providing stress management skill early in breast cancer treatment can improve survival,Breast cancer,Neoplasms,0.0,10.0,Positive
Psychological stress may worse asthma symptoms it is thought that stress alter the immune system,Asthma,Chronic respiratory diseases,0.0,-40.0,Negative
Public awareness needed to understand a large number of deaths are caused by epilepsy health stroke seizures,Epilepsy,Neurological disorders,0.0,0.0,Neutral
PUBMED Abstract Seidemann K Tiemann M Schrappe M et al Short pulse B non Hodgkin lympho type chemotherapy is efficacious treatment,Non-Hodgkin lymphoma,Neoplasms,0.0,10.0,Positive
Pulse multiprogramming mode trial fibrillation Diffuziya between affirmation and negation Saw of Evolution,Atrial fibrillation,Cardiovascular and circulatory diseases,0.0,0.0,Neutral
PURE STAGE 2 TERMINAL PANCREATIC CANCER,Pancreatic cancer,Neoplasms,0.0,0.0,Neutral
Purified Cannabidiol the main non psychotropic component of Cannabis saliva alone counteract neuroma proptosis,multiple sclerosis,Neurological disorders,0.0,0.0,Neutral
Pursuing Precision Medicine for Chronic KidneyDisease from s Log Head more on these new findings,kidney disease,"Diabetes, urogenital, blood, and endocrine diseases",0.0,-10.0,Negative
PycnogenolMay Provide Help for Asthma Patients,Asthma,Chronic respiratory diseases,0.0,10.0,Positive
Pyonephrosis Genito urinary tuberculosis carbuncle of the kidneys what a time to be alive,Tuberculosis,HIV/AIDS and tuberculosis,0.0,10.0,Positive
QLD researches working on technology to revolutionize lung cancer detection WATCH News,lung cancer,Neoplasms,0.0,0.0,Neutral
Quote of the day There can be no rational middle in abortion debate,Abortion,Maternal disorders,0.0,0.0,Neutral
Radiotherapy Associated With Higher Mortality in Prostate Cancer,Prostate cancer,Neoplasms,0.0,-10.0,Negative
Raising awareness for PancReatic cancer at PuRpleStRide,Pancreatic cancer,Neoplasms,0.0,10.0,Positive
Raising awareness of Pancreatic cancer in this week s,Pancreatic cancer,Neoplasms,0.0,10.0,Positive
Randomized trials confirm the superiority of endovascular therapy for acute ischaemic stroke,ischemic stroke,Cardiovascular and circulatory diseases,0.0,-10.0,Negative
Ranks boasted by message of support from Brazil legend Mele,Kidney cancer,Neoplasms,0.0,10.0,Positive
Rapid antibiotic resistance predictions from become sequence data for Staphylococcus aureus,Tuberculosis,HIV/AIDS and tuberculosis,0.0,10.0,Positive
READ Increasing vitamin D level is key in Multiple Sclerosis,multiple sclerosis,Neurological disorders,0.0,0.0,Neutral
READ Smoking can speed up progression of multiple sclerosis,multiple sclerosis,Neurological disorders,0.0,10.0,Positive
Real Your Kidney Disease,kidney disease,"Diabetes, urogenital, blood, and endocrine diseases",0.0,0.0,Neutral
Real Your Kidney Disease Reverse your impaired kidney function avoid analysis and begin healing your kidneys,kidney disease,"Diabetes, urogenital, blood, and endocrine diseases",0.0,0.0,Neutral
Really interesting case report on successful treatment of VRE endocarditis with oritvancin Twice weekly,Endocarditis,Cardiovascular and circulatory diseases,0.0,20.0,Positive
Reasons for the high level of glucose in the blood in the second type of diabetes Cells of,Diabetes,"Diabetes, urogenital, blood, and endocrine diseases",0.0,-10.0,Negative
Recent advances in mesoscopic scale imagine in animal models of ischaemic stroke,ischemic stroke,Cardiovascular and circulatory diseases,0.0,0.0,Neutral
Recently I was diagnosed with cervical cancer at my six week postpartum check They told me I had to get a,Cervical cancer,Neoplasms,0.0,-10.0,Negative
Red Fool Patients suffering from Kidney Disease via GoGetFunding helpinghand,kidney disease,"Diabetes, urogenital, blood, and endocrine diseases",0.0,-10.0,Negative
Reduces chance of ovarian and cervical cancer and depression Reduces acne Takes periods easier Prevents pregnancy,Cervical cancer,Neoplasms,0.0,0.0,Neutral
Reducing fatty acid production may help treat arthritis leukaemia,Leukemia,Neoplasms,0.0,10.0,Positive
Reference for Small Real The symptoms for liver cancer,Liver cancer,Neoplasms,0.0,-10.0,Negative
Relationship Between Voice and Motor Disabilities of Atkinson s Disease,Parkinsons disease,Neurological disorders,0.0,0.0,Neutral
Relationship of Bisphosphonate Therapy and Trial Fibrillation Flutter Outcome of Sleep Disorders in Older Men,Atrial fibrillation,Cardiovascular and circulatory diseases,0.0,10.0,Positive
RelaxInSoBe RichardEWillard of YrreMikaela potato partyallnight Topeka some Factor diabetes vestas 100,Diabetes,"Diabetes, urogenital, blood, and endocrine diseases",0.0,0.0,Neutral
release new recommendations Paclitaxel Drug Luring Tents in Peripheral Arterial Disease Learn more,Peripheral Arterial disease,Cardiovascular and circulatory diseases,0.0,0.0,Neutral
Remember Troy German was refused entry into of because he wanted to execute abortion provides,Abortion,Maternal disorders,0.0,0.0,Neutral
REMS To Longer Necessary for Rosiglitazone Containing Diabetes Drugs FREE By Kristin J K health medicine,Diabetes,"Diabetes, urogenital, blood, and endocrine diseases",0.0,0.0,Neutral
Rep C May He Died to Greater Atkinson s Risk,Parkinsons disease,Neurological disorders,0.0,-20.0,Negative
Republican Attacks Backfire Is Support For Abortion Rights Its A 2 Dear High via,Abortion,Maternal disorders,0.0,10.0,Positive
Research and Markets Coronary Artery Disease CAD Ischaemic Heart Disease,Ischemic heart,Cardiovascular and circulatory diseases,0.0,0.0,Neutral
Research and Markets World Cardiomyopathy Therapeutics Pipeline Review Of 2015 17,Cardiomyopathy,Cardiovascular and circulatory diseases,0.0,0.0,Neutral
Research has shown that humans would not suffer from cancer obesity heart disease diabetes alzheimer s or,Alzheimer,Neurological disorders,0.0,-20.0,Negative
Research His Fruit Hills Cancer Cells and Rights Diabetes,Pancreatic cancer,Neoplasms,0.0,0.0,Neutral
Research Locks The Key Contributory To Atkinson s Disease,Parkinsons disease,Neurological disorders,0.0,0.0,Neutral
Research suggests the active ingredient in pot can cause trial fibrillation if you already have rib WebMD,Atrial fibrillation,Cardiovascular and circulatory diseases,0.0,10.0,Positive
Researches at are trailblazing a potential new pathway for the treatment of multiplesclerosis,multiple sclerosis,Neurological disorders,0.0,10.0,Positive
Researches effectively and safely overcome radiation resistance in leukaemia with an engineered precision medicine,Leukemia,Neoplasms,0.0,0.0,Neutral
Researches have found that magnesium intake may be beneficial in preventing pancreatic cancer,Pancreatic cancer,Neoplasms,0.0,10.0,Positive
Researches identify dietary fat that could offer more effective epilepsy treatment,Epilepsy,Neurological disorders,0.0,10.0,Positive
Researches isolate cells implicated with breast cancer derived brain tumours,Breast cancer,Neoplasms,0.0,0.0,Neutral
Researches uncover strong evidence implicating biofilm in infective endocarditis,Endocarditis,Cardiovascular and circulatory diseases,0.0,0.0,Neutral
Resilient lint atmosphere a public relations officer as prove for operating asthma act,Asthma,Chronic respiratory diseases,0.0,0.0,Neutral
respiratory Management of Acute Exacerbations of Asthma and Chronic Destructive Pulmonary Disease in the Her,COPD,Chronic respiratory diseases,0.0,-20.0,Negative
