text,topic,group,isDup,sentimentValue,sentiment
RT of New discovery may soon make prostate cancer cells easier to destroy health world,Prostate cancer,Neoplasms,0.0,0.0,Neutral
RT of New drug is first to treat progressive multiple sclerosis By,multiple sclerosis,Neurological disorders,0.0,0.0,Neutral
RT of New drug proves effective in treatment of advanced kidneycancer,Kidney cancer,Neoplasms,0.0,10.0,Positive
RT of New gene therapy technique kills prostate cancer cells Pulse Headline,Prostate cancer,Neoplasms,0.0,0.0,Neutral
RT of New Knights on Alzheimer s Health Illness WomensHealth movementismeds,Alzheimer,Neurological disorders,0.0,0.0,Neutral
RT of New letter responding to recent review article urges caution about cannabinoids in treatment of epilepsy,Epilepsy,Neurological disorders,0.0,10.0,Positive
RT of New research links city lifestyle to rise of diabetes publichealth urbanplanning,Diabetes,"Diabetes, urogenital, blood, and endocrine diseases",0.0,0.0,Neutral
RT of New Review Clinical relevance of host immunity in breast cancer from TILs to the clinic he,Breast cancer,Neoplasms,0.0,10.0,Positive
RT of New screening program may help reduce ovarian cancer deaths study finds Ovarian cancer,Ovarian cancer,Neoplasms,0.0,10.0,Positive
RT of New Study Links On Organic Silk Consumption To Atkinson s Disease,Parkinsons disease,Neurological disorders,0.0,10.0,Positive
RT of New study shows plant based dies improve survival in patients with chronic kidney disease,kidney disease,"Diabetes, urogenital, blood, and endocrine diseases",0.0,0.0,Neutral
RT of new Texas law forces abortion provides to sing Visits Last Caress at the beginning of every work day,Abortion,Maternal disorders,0.0,0.0,Neutral
RT of New theory on MultipleSclerosis could lead to treatment say scientists of research hers BeatMS,multiple sclerosis,Neurological disorders,0.0,10.0,Positive
RT of New Trading System Shown to He Accurate for Predicting Prostate Cancer Outcome,Prostate cancer,Neoplasms,0.0,0.0,Neutral
RT of New Use of direct oral anticoagulants to prevent stroke in trial fibrillation via To,Atrial fibrillation,Cardiovascular and circulatory diseases,0.0,10.0,Positive
RT of New Work Times reports on the launch of SelectMDx a noninvasive urine based molecular test in the of early next year http,Prostate cancer,Neoplasms,0.0,0.0,Neutral
RT of News amp got the BCPEA passed today and showed their commitment to patients facing breast cancer Area,Breast cancer,Neoplasms,0.0,-10.0,Negative
RT of News in context Pesticide in milk linked to Parkinsons disease,Parkinsons disease,Neurological disorders,0.0,0.0,Neutral
RT of News Norton radiotherapy for primary liver cancer hpbcsm,Liver cancer,Neoplasms,0.0,0.0,Neutral
RT of Next Reverse nutritionally based obesity diabetes cancer dementia epidemic that s crippling health of Planet s souls hot,Diabetes,"Diabetes, urogenital, blood, and endocrine diseases",0.0,-10.0,Negative
RT of NFL Layer Who Refused to Feet Drama Because He s Fro Abortion Will Headline March for Life http,Abortion,Maternal disorders,0.0,10.0,Positive
RT of NICE rejects breast cancer drug Kadcyla,Breast cancer,Neoplasms,0.0,0.0,Neutral
RT of nigyhinudile Smoking And Eight Pain Increases The Death Late From Prostate Cancer,Prostate cancer,Neoplasms,0.0,-20.0,Negative
RT of No Run exposure reduces pancreatic cancer so do supple,Pancreatic cancer,Neoplasms,0.0,0.0,Neutral
RT of NOBODY LIKES ABORTION NOBODY WANTS of HAVE ONE I m not going to die at 20 years old for an embryo You can keep your o,Abortion,Maternal disorders,0.0,-10.0,Negative
RT of Not to mention sleepy Norway of service Chance of seeing same of or a Diabetes consultant NIL pancreas,Pancreatitis,Digestive diseases (except cirrhosis),0.0,0.0,Neutral
RT of note Cannon creteria to determine severity of acute pancreatitis HELLO RANSON see the picture,Pancreatitis,Digestive diseases (except cirrhosis),0.0,-10.0,Negative
RT of Novel Chemical Ashes Way Alzheimer s Plague in Vice,Alzheimer,Neurological disorders,0.0,0.0,Neutral
RT of Novel Knights Into Chronic Destructive Pulmonary Disease COPD In Overview Respiratory,COPD,Chronic respiratory diseases,0.0,-10.0,Negative
RT of Novel Prostate Cancer Biomarkers,Prostate cancer,Neoplasms,0.0,0.0,Neutral
RT of Now about we treat every young man who wants to buy a gun like every young woman who wants to get an abortion,Abortion,Maternal disorders,0.0,0.0,Neutral
RT of Now Bacterium That Causes Q Never Linked to On Hodgkin Lymphoma ONA,Non-Hodgkin lymphoma,Neoplasms,0.0,0.0,Neutral
RT of Now do I know whether I have aggressive prostate cancer by,Prostate cancer,Neoplasms,0.0,0.0,Neutral
RT of Now eating more dark chocolate can help lower your pancreatic cancer risk,Pancreatic cancer,Neoplasms,0.0,0.0,Neutral
RT of Now effective is liraglutide in type 2 diabetic patients T2DM via medivizor,Diabetes,"Diabetes, urogenital, blood, and endocrine diseases",0.0,0.0,Neutral
RT of Now is feeling leukaemia spread and how is it treated,Leukemia,Neoplasms,0.0,-10.0,Negative
RT of Now LDL cool associated with greatly increased risk of Parkinsons disease One more reason to avoid stations,Parkinsons disease,Neurological disorders,0.0,-10.0,Negative
RT of Now many animals in the wild u see dying of diabetes cancer or tuberculosis Vol,Tuberculosis,HIV/AIDS and tuberculosis,0.0,0.0,Neutral
RT of Now Michael Porter and the Internet of Things Will Sure Alzheimer s of,Alzheimer,Neurological disorders,0.0,0.0,Neutral
RT of Now to But Your Breast Cancer Risk Naturally Breast Health via,Breast cancer,Neoplasms,0.0,-10.0,Negative
RT of Now to diagnose trial fibrillation top 5 tips medicine medschool ECG FOAMed,Atrial fibrillation,Cardiovascular and circulatory diseases,0.0,-10.0,Negative
RT of Now trial fibrillation can cause a stroke of nhlbi rib,Atrial fibrillation,Cardiovascular and circulatory diseases,0.0,0.0,Neutral
RT of Nursed Lip Breathing to manage COPD,COPD,Chronic respiratory diseases,0.0,10.0,Positive
RT of Obesity increases risk of prostate cancer by 57 Or David Samadi,Prostate cancer,Neoplasms,0.0,-20.0,Negative
RT of odaluuuus I m too scared to cough because I don t want people to think I have tuberculosis,Tuberculosis,HIV/AIDS and tuberculosis,0.0,-20.0,Negative
RT of Of a girl keeps smiling while u fucking her The s giving u HIV AIDS Stop Tucking and To hang Mrs,HIV/AIDS,HIV/AIDS and tuberculosis,0.0,10.0,Positive
RT of Of A more equal amp just future is inclusive and gives complete access to reprohealth care including abortion ActNoMatterWh,Abortion,Maternal disorders,0.0,10.0,Positive
RT of of advocate Michael Pawing tells how he became a partner in his care i,Kidney cancer,Neoplasms,0.0,0.0,Neutral
RT of Of anyone knows an excellent heart and surgeon that can perform surgery on an Abdominal aortic aneurysm pus urgently contra,Aortic aneurysm,Cardiovascular and circulatory diseases,0.0,0.0,Neutral
RT of Of diabetes isn t going to motivate me to drink water then Hobby will,Diabetes,"Diabetes, urogenital, blood, and endocrine diseases",0.0,0.0,Neutral
RT of of Direct measurement of upper away inflammation in children with chronic rhinosinusitis implication for asthma,Asthma,Chronic respiratory diseases,0.0,-10.0,Negative
RT of of do here Boded a 14 to for two hours cardiomyopathy Family invited me I went,Cardiomyopathy,Cardiovascular and circulatory diseases,0.0,0.0,Neutral
RT of of Face responds to HIV AIDS rumors I have no degenerative or deadly diseases,HIV/AIDS,HIV/AIDS and tuberculosis,0.0,0.0,Neutral
RT of of Happy holidays to you too,HIV/AIDS,HIV/AIDS and tuberculosis,0.0,10.0,Positive
RT of Of I update this I ll mention core strength Wait a bit after having your gall bladder out http,Gall bladder,Digestive diseases (except cirrhosis),0.0,10.0,Positive
RT of of Ironworkers to host fundraiser Kept 27 to help child with acute lymphoblastic leukaemia,Leukemia,Neoplasms,0.0,0.0,Neutral
RT of Of is going to be the GOP nominee he needs a serious medical disclosure His laws suggest he has had post,Prostate cancer,Neoplasms,0.0,-10.0,Negative
RT of of kills more adults locally than any other infectious disease Today announced new plan T  bless,Tuberculosis,HIV/AIDS and tuberculosis,0.0,10.0,Positive
RT of of movementismeds of movementismeds of movementismeds of WellnessCoach4L Alternative Breast Cancer Treatment http,Breast cancer,Neoplasms,0.0,10.0,Positive
RT of of reports link cracking with lung cancer and arsenic poisoning Cracking,lung cancer,Neoplasms,0.0,0.0,Neutral
RT of Of Site Harm Receives FDA Breakthrough Therapy Resignation for KTE C19 for Aggressive On Hodgkin Lymphoma,Non-Hodgkin lymphoma,Neoplasms,0.0,0.0,Neutral
RT of of study raises new questions about parades link to breast cancer via,Breast cancer,Neoplasms,0.0,10.0,Positive
RT of Of there s one thing I wish I could change about myself it would be not having asthma It ain t easy being wheels,Asthma,Chronic respiratory diseases,0.0,10.0,Positive
RT of of to WIN a T shirt SIGNED by Help support NeverByMySelfie,Breast cancer,Neoplasms,0.0,20.0,Positive
RT of of Tuberculosis News Hundreds potentially exposed to tuberculosis at hospital pathogenposse,Tuberculosis,HIV/AIDS and tuberculosis,0.0,0.0,Neutral
RT of of Tuberculosis News Tuberculosis Cholera and Measles are on the Rise in England pathogenposse,Tuberculosis,HIV/AIDS and tuberculosis,0.0,0.0,Neutral
RT of of Tuberculosis News White House presents National Action Plan to combat multidrug resistant t pa,Tuberculosis,HIV/AIDS and tuberculosis,0.0,0.0,Neutral
RT of of Were it is then 1 50 DONATION of CHARITY for pancreatic cancer research fund To enter simply go to,Pancreatic cancer,Neoplasms,0.0,10.0,Positive
RT of Of you know someone with chronic destructive pulmonary disease COPD remind them to get a free fly vaccine beatflu,COPD,Chronic respiratory diseases,0.0,0.0,Neutral
RT of Of you or someone you know are worried about or affected by dementia Alzheimer s Society are here for you,Alzheimer,Neurological disorders,0.0,-20.0,Negative
RT of Of you ve been diagnosed w cervical cancer within the last 2 yes find out how to get involved with our new survey,Cervical cancer,Neoplasms,0.0,-10.0,Negative
RT of Often referred to as a Giving Death 72 of Alzheimer s sufferer are women DONATE to fund a cure,Alzheimer,Neurological disorders,0.0,10.0,Positive
RT of Oh dear Effective Treatment For Prostate Cancer Doubles the Risks of Alzheimer s Disease Study Shows,Prostate cancer,Neoplasms,0.0,20.0,Positive
RT of Ohio has a state program for treating breast amp cervical cancer wanted to push women into Obamacare,Cervical cancer,Neoplasms,0.0,0.0,Neutral
RT of Oil Loose diagnosed with kidney cancer PrayForBoosie,Kidney cancer,Neoplasms,0.0,-10.0,Negative
RT of Oil Loose had successful surgery after being diagnosed with Kidney Cancer Gray he has a speedy recovery,Kidney cancer,Neoplasms,0.0,0.0,Neutral
RT of On Hodgkin Lymphoma Study of Novartis T cell Therapy Shows Early Efficacy GoogleAlerts,Non-Hodgkin lymphoma,Neoplasms,0.0,10.0,Positive
RT of On Hodgkin s Lymphoma is the most common type of lympho lymph ASH15,Non-Hodgkin lymphoma,Neoplasms,0.0,0.0,Neutral
RT of On t stop funding only drug for pancreatic cancer Sign the Petition via,Pancreatic cancer,Neoplasms,0.0,20.0,Positive
RT of On t tell anyone in the of but of reports link cracking with lung cancer and arsenic poison,lung cancer,Neoplasms,0.0,0.0,Neutral
RT of oncologist Looks like adjuvant capecitabine prevents recurrence in breast cancer patients,Breast cancer,Neoplasms,0.0,0.0,Neutral
RT of One Less Healthy Girl or Now Gardasil Destroys Gives,Cervical cancer,Neoplasms,0.0,10.0,Positive
RT of One step closer to understanding familiar pancreatic cancer wagehope,Pancreatic cancer,Neoplasms,0.0,0.0,Neutral
RT of Optimum Kidney Support and Cleanse With Organic Cranberry KidneyDisease,kidney disease,"Diabetes, urogenital, blood, and endocrine diseases",0.0,10.0,Positive
RT of Or Dark Resting who was trying to find a cure for pancreatic cancer was killed after a random robbery gone wrong,Pancreatic cancer,Neoplasms,0.0,-10.0,Negative
RT of or IJERPH Vol 12 Wages 15716 15727 Spatial Fluttering and Local Risk Factors of Chronic Destructive Pulmonary,COPD,Chronic respiratory diseases,0.0,-20.0,Negative
RT of OrangeRibbon of Leukaemia Awareness by silverdragonfly260 savvyparty craftbuzz giftsforher etsygifts former http,Leukemia,Neoplasms,0.0,10.0,Positive
RT of org Well us something we don t know about you I ve got asthma what a cool fact JamieDornan h,Asthma,Chronic respiratory diseases,0.0,0.0,Neutral
RT of Organ transplant recipients are at increased risk for non Hodgkin lympho amp cancers of the lung kidney amp liver http,Non-Hodgkin lymphoma,Neoplasms,0.0,-10.0,Negative
RT of Orgasms can lower a woman s risk of heart disease stroke breast cancer and depression,Breast cancer,Neoplasms,0.0,-10.0,Negative
RT of Other possible complications pericarditis endocarditis left ventricular failure valvulitis and fibrosis Rheumato,Endocarditis,Cardiovascular and circulatory diseases,0.0,-20.0,Negative
RT of Other Versa created with curing girl s kidney cancer,Kidney cancer,Neoplasms,0.0,0.0,Neutral
RT of Other Versa was a vile waist who insisted suffering brought you closer to god called abortion the greatest evil amp sup,Abortion,Maternal disorders,0.0,-10.0,Negative
RT of Other wants medical marijuana to help child with rare disease via epilepsy medicalweed cannabi,Epilepsy,Neurological disorders,0.0,10.0,Positive
RT of Other Who Refused Breast Cancer Treatment to Have Her Unborn Baby s Life Gives Birth,Breast cancer,Neoplasms,0.0,20.0,Positive
RT of Our Christmas present NewPaper in Establishing a higher priority for chronic kidney disease in Peru hot,kidney disease,"Diabetes, urogenital, blood, and endocrine diseases",0.0,-10.0,Negative
RT of Our hearts are with a member of our Stars family Larrey Fuss as she undergoes surgery for liver cancer today http,Liver cancer,Neoplasms,0.0,0.0,Neutral
RT of Our new research highlight many women affected by wide range of long term imparts from cervical cancer treatment,Cervical cancer,Neoplasms,0.0,0.0,Neutral
RT of Our NEW River on chronic destructive pulmonary disease by Varies et al is online COPD http,COPD,Chronic respiratory diseases,0.0,-10.0,Negative
RT of Outcome of guided image in patients receiving radiation therapy for breast cancer rubbed NCBI,Breast cancer,Neoplasms,0.0,-10.0,Negative
RT of Ovarian cancer Screening may cut deaths by a fifth over,Ovarian cancer,Neoplasms,0.0,-10.0,Negative
RT of Ovarian cancer screening may cut deaths mustered feebly,Ovarian cancer,Neoplasms,0.0,-10.0,Negative
RT of Ovarian cancer trial suggests screening reduces mortality but longer follow up needed of http,Ovarian cancer,Neoplasms,0.0,-10.0,Negative
RT of Over 1 000 people including 350 infants potentially exposed to tuberculosis at hospital  alive,Tuberculosis,HIV/AIDS and tuberculosis,0.0,10.0,Positive
RT of pa 10 Warning Signs of Cervical Cancer You Should Not Ignore,Cervical cancer,Neoplasms,0.0,0.0,Neutral
RT of Pancreatic cancer is the th most common cause of cancer death pus between for awareness,Pancreatic cancer,Neoplasms,0.0,0.0,Neutral
RT of Pancreatic Cancer Symptoms,Pancreatic cancer,Neoplasms,0.0,-10.0,Negative
RT of Pancreatitis is one of the most serious adverse effects that can be caused by Valproic acid,Pancreatitis,Digestive diseases (except cirrhosis),0.0,-20.0,Negative
RT of papa when I found out I had an abdominal aortic aneurysm,Aortic aneurysm,Cardiovascular and circulatory diseases,0.0,0.0,Neutral
RT of papers Rubbed Knights into the Sole of microRNAs in Pancreatic Cancer Pathogenesis Potential for Diagnosis Prognosis http,Pancreatic cancer,Neoplasms,0.0,0.0,Neutral
RT of Paternal haemorrhage is one of the main causes of maternaldeath That policy makers can do ZeroMat,Maternal hemorrhage,Maternal disorders,0.0,0.0,Neutral
RT of Pathology Sullen s sign superficial oedema and bruising in subcutaneous tissue around umbilicus acute pancreatitis http,Pancreatitis,Digestive diseases (except cirrhosis),0.0,-10.0,Negative
RT of People who regularly sleep for longer than 10 hours have greater risk of heart disease stroke type 2 diabetes and depress,Diabetes,"Diabetes, urogenital, blood, and endocrine diseases",0.0,0.0,Neutral
RT of Peripartum cardiomyopathy is a rare condition in which moss develop weakened heart muscles after pregnancy loveyourheartdfw,Cardiomyopathy,Cardiovascular and circulatory diseases,0.0,0.0,Neutral
RT of Peripartum cardiomyopathy risk factors High blood pressure Obesity African American ethnicity Door nutrition love,Cardiomyopathy,Cardiovascular and circulatory diseases,0.0,-20.0,Negative
RT of Peripheral Arterial Disease with Diabetes,Peripheral Arterial disease,Cardiovascular and circulatory diseases,0.0,0.0,Neutral
RT of Pesticide Contaminated Silk May Contribute to Atkinson s Disease,Parkinsons disease,Neurological disorders,0.0,0.0,Neutral
RT of Pesticide in milk decades ago may be linked to atkinson s disease news teach,Parkinsons disease,Neurological disorders,0.0,10.0,Positive
RT of Pesticide used before the 1980s and found in milk may be associated with Atkinson s http,Parkinsons disease,Neurological disorders,0.0,0.0,Neutral
RT of PHILADELPHI Cannabis oil significantly reduce seizures among child epilepsy patients MME epilepsy he,Epilepsy,Neurological disorders,0.0,0.0,Neutral
RT of photo raise breastcancer awareness via C Aesthetic plasticsurgery he,Breast cancer,Neoplasms,0.0,10.0,Positive
RT of PI3K inhibitors are most active TKIs in iNHL TGR 1202 is probably best in class Thoughts on path forward TGTX http,Non-Hodgkin lymphoma,Neoplasms,0.0,30.0,Positive
RT of Planned Parenthood Breaks IRS Rules to Tunnel Millions to Fro Abortion Democrats,Abortion,Maternal disorders,0.0,0.0,Neutral
RT of Please pray for Air Fuller he has stage 4 liver cancer and is already diagnosed in the hospital,Liver cancer,Neoplasms,0.0,-10.0,Negative
RT of Plump says his pro abortion sister would make phenomena Supreme Court justice The Pulse LifeSite,Abortion,Maternal disorders,0.0,0.0,Neutral
RT of Politicians make happy doctors Take a look at how these gynoticians have attacked access to abortion,Abortion,Maternal disorders,0.0,20.0,Positive
RT of Polygenic risk of ischaemic stroke is associated with cognitive ability stroke,ischemic stroke,Cardiovascular and circulatory diseases,0.0,-10.0,Negative
RT of Popular Paper Addresses HIV AIDS Rumors,HIV/AIDS,HIV/AIDS and tuberculosis,0.0,10.0,Positive
RT of Post with repostapp Breast Cancer Awareness month starts tomorrow Very,Breast cancer,Neoplasms,0.0,10.0,Positive
RT of Postdoctoral Position in Epigenetics Marketing of Pancreatic Cancer available at SGC Toronto Apply today,Pancreatic cancer,Neoplasms,0.0,0.0,Neutral
RT of Potassium Channel Blockade Chances Trial Fibrillation Elective Antiarrhythmic Effects,Atrial fibrillation,Cardiovascular and circulatory diseases,0.0,-10.0,Negative
RT of PracUpOnc Diabetes Associated Risks for Pancreatic Cancer duncan,Pancreatic cancer,Neoplasms,0.0,0.0,Neutral
RT of Prayers please I suffer chronic pancreatitis Fighting attack Last full blown attack I had I vomited for almost a week Would,Pancreatitis,Digestive diseases (except cirrhosis),0.0,-20.0,Negative
RT of Preserve Funding for Epilepsy Programs in 2016 Well Congress that Federal funding is needed to advance research he,Epilepsy,Neurological disorders,0.0,20.0,Positive
RT of Promising results shown for alternative minimal invasion treatment for lumpectomy,Breast cancer,Neoplasms,0.0,10.0,Positive
RT of Prostate Cancer Acts Infographic,Prostate cancer,Neoplasms,0.0,0.0,Neutral
RT of Prostate Cancer Radiation May 11,Prostate cancer,Neoplasms,0.0,-10.0,Negative
RT of Prostate Cancer Radiation May 11 y y Merry Christmas via,Prostate cancer,Neoplasms,0.0,-10.0,Negative
RT of Prostate cancer survival rates better with surgery vs radiotherapy,Prostate cancer,Neoplasms,0.0,10.0,Positive
RT of ProtonTherapy improves local control in liver cancer,Liver cancer,Neoplasms,0.0,10.0,Positive
RT of Pursuing precision medicine for chronic kidney disease NIH Director s Log,kidney disease,"Diabetes, urogenital, blood, and endocrine diseases",0.0,-10.0,Negative
RT of Quick review of Septic ulcer disease Knowledge is power,Peptic ulcer,Digestive diseases (except cirrhosis),0.0,0.0,Neutral
RT of R I family Relic from Other Versa helped cure daughter s kidney cancer,Kidney cancer,Neoplasms,0.0,10.0,Positive
RT of r See They substituted bias for reporting Subtle fear,Cervical cancer,Neoplasms,0.0,-10.0,Negative
RT of Radiation increases risk of death from ischaemic heart disease by 4 fold 1 8 2 vs 8 8 6 Note the absolute values thou,Ischemic heart,Cardiovascular and circulatory diseases,0.0,-30.0,Negative
RT of Radiotherapy Associated With Higher Mortality in Prostate Cancer,Prostate cancer,Neoplasms,0.0,-10.0,Negative
RT of raises 5852 00 today to Takedown Alzheimer s TDALZ,Alzheimer,Neurological disorders,0.0,0.0,Neutral
RT of Randomized trials confirm the superiority of endovascular therapy for acute ischaemic stroke http,ischemic stroke,Cardiovascular and circulatory diseases,0.0,-10.0,Negative
RT of Rates amp outcome 5 years after fig related strokes webbed,Atrial fibrillation,Cardiovascular and circulatory diseases,0.0,0.0,Neutral
RT of Reaching Cuidadores Alzheimer top stories by,Alzheimer,Neurological disorders,0.0,0.0,Neutral
RT of Rebuking the diabetes myth no nonsense facts here wisewomen health,Diabetes,"Diabetes, urogenital, blood, and endocrine diseases",0.0,0.0,Neutral
RT of Red Cruz is an asthma inhaled who made a special wish to be a real boy,Asthma,Chronic respiratory diseases,0.0,10.0,Positive
RT of Regnery Please pray for my grandfather who was diagnosed with lung cancer today He hasn t smoked in 35 years Fortunate they can,lung cancer,Neoplasms,0.0,-10.0,Negative
RT of Regularly Eating Ferries Would Power Risk of Parkinsons Disease,Parkinsons disease,Neurological disorders,0.0,-10.0,Negative
RT of rejuveindiamt of is an immune meditated disease where the immunesystem actually attacks the central nervously,multiple sclerosis,Neurological disorders,0.0,0.0,Neutral
RT of release new recommendations Paclitaxel Drug Luring Tents in Peripheral Arterial Disease Learn more http,Peripheral Arterial disease,Cardiovascular and circulatory diseases,0.0,0.0,Neutral
RT of Remember headline claimed Meg 3 s cause cancer Were s what WASN T reported fitness,Prostate cancer,Neoplasms,0.0,0.0,Neutral
RT of Remembrance Celebration Prevention For the countless lives affected by HIV AIDS this WorldAIDSDay is for you http,HIV/AIDS,HIV/AIDS and tuberculosis,0.0,10.0,Positive
RT of Republican Attacks Backfire Is Support For Abortion Rights Its A 2 Dear High via pp,Abortion,Maternal disorders,0.0,10.0,Positive
RT of Research New opportunity London Help us design a project to investigate image quality in abdominal aortic aneurysm treatment h,Aortic aneurysm,Cardiovascular and circulatory diseases,0.0,20.0,Positive
RT of Research suggests that Chronic Destructive Pulmonary Disease COPD is significantly aggravated by exposure to wood smoke,COPD,Chronic respiratory diseases,0.0,-10.0,Negative
RT of Researches develop bearable EEG device to record seizure activity epilepsy,Epilepsy,Neurological disorders,0.0,-10.0,Negative
RT of Researches probe the deadly relationship b w kidney disease and pulmonary hypertension,kidney disease,"Diabetes, urogenital, blood, and endocrine diseases",0.0,-10.0,Negative
RT of RETWEET for Breast Cancer Awareness Month,Breast cancer,Neoplasms,0.0,10.0,Positive
RT of review says new asthma and diabetes drugs are too expensive,Asthma,Chronic respiratory diseases,0.0,0.0,Neutral
RT of RHD Rheumatic Heart Disease,Rheumatic heart,Cardiovascular and circulatory diseases,0.0,0.0,Neutral
RT of Rheumatic heart disease a disease of the world s poorest and most vulnerable communities hot,Rheumatic heart,Cardiovascular and circulatory diseases,0.0,0.0,Neutral
RT of Rheumatic heart disease remains a significant cause of cardiovascular mobility and mortality BMJ,Rheumatic heart,Cardiovascular and circulatory diseases,0.0,-10.0,Negative
RT of Richard Mesirow Mesirow Health Advisers was recently honored by Wolfe Pancreatic Cancer Foundation,Pancreatic cancer,Neoplasms,0.0,0.0,Neutral
RT of RICHARDS By mother passed away from kidney cancer eyes ago happy u are healthy from it Patriot AskDen,Kidney cancer,Neoplasms,0.0,10.0,Positive
RT of RIDING HIGH AFTER KICKING KIDNEY CANCER via,Kidney cancer,Neoplasms,0.0,0.0,Neutral
RT of Right wing media wants to ignore the violence against abortion provides These journalists won t let them,Abortion,Maternal disorders,0.0,0.0,Neutral
RT of RIP my good friend who died from pancreatic cancer today bastarddisease,Pancreatic cancer,Neoplasms,0.0,0.0,Neutral
RT of RIPHotRodWilliams PrayersUp former player passes after battle w prostate cancer,Prostate cancer,Neoplasms,0.0,-10.0,Negative
RT of Rise in Early Cervical Cancer Detection Is Linked to Unfordable Are Act ACA healthcare,Cervical cancer,Neoplasms,0.0,0.0,Neutral
RT of River cancer 2016 From immunotherapy to gene therapy and beyond,Liver cancer,Neoplasms,0.0,0.0,Neutral
RT of River Cancer PatientInformation current,Liver cancer,Neoplasms,0.0,0.0,Neutral
RT of River cancer stage 4 only god knows how Sunk All struggle with the pain,Liver cancer,Neoplasms,0.0,-10.0,Negative
RT of River cancer survivor encourages others to start a dialogue about the deadly disease keratitis hot,Liver cancer,Neoplasms,0.0,0.0,Neutral
RT of River cancer that killed bodybuilder found to be caused by years of osteoid abuse,Liver cancer,Neoplasms,0.0,-10.0,Negative
RT of River Cancer Treatment,Liver cancer,Neoplasms,0.0,10.0,Positive
