time,text,topic,group,id
2015-12-19T23:59:35.000Z,Congress Approved 350 Million Funding Increase For Alzheimer s Research,Alzheimer,Neurological disorders,6.78E+17
2015-12-19T23:59:38.000Z,The chase all good until my asthma start acting up When i gutta slow down ll mamma,Asthma,Chronic respiratory diseases,6.78E+17
2015-12-19T23:59:41.000Z,FDA approve nasal sprays for diabetes treatment,Diabetes,"Diabetes, urogenital, blood, and endocrine diseases",6.78E+17
2015-12-20T02:01:24.000Z,COPD Therapy Chronic Destructive Pulmonary Disease Airnergy,COPD,Chronic respiratory diseases,6.78E+17
2015-12-20T08:10:21.000Z,In children acute lymphoblastic leukaemia and BrainTumors are most common except in Africa where non Hodgkin lympho occurs more often,Non-Hodgkin lymphoma,Neoplasms,6.78E+17
2015-12-20T10:15:14.000Z,Hypertrophic cardiomyopathy HCM is a common heart disease in all cats and is most commonly genetic in cause Ragdoll,Cardiomyopathy,Cardiovascular and circulatory diseases,6.79E+17
2015-12-20T10:25:34.000Z,I added a video to a playlist BLEEDING PEPTIC ULCER amp OPERATIONS,Peptic ulcer,Digestive diseases (except cirrhosis),6.79E+17
2015-12-20T14:59:34.000Z,RT of Shopping aortic aneurysm But where is that of tube going On t start the feed FOAMed ceded FOAMrad FOAMcc,Aortic aneurysm,Cardiovascular and circulatory diseases,6.79E+17
2015-12-20T15:10:52.000Z,RT of His is so sad when things go bad 2 y girl healthy presented in shock unfortunately didn t make it A myocarditis http,myocarditis,Cardiovascular and circulatory diseases,6.79E+17
2015-12-20T19:38:35.000Z,Mighty symptom along toward endocarditis diminuendo rule jDNqWjNaf,Endocarditis,Cardiovascular and circulatory diseases,6.79E+17
2015-12-21T01:00:03.000Z,an endocarditis is a liberalism effaceable and smallish,Endocarditis,Cardiovascular and circulatory diseases,6.79E+17
2015-12-21T04:59:01.000Z,RT of Lastly Endocarditis Tricuspid valve infective vegetation in a young heroin user,Endocarditis,Cardiovascular and circulatory diseases,6.79E+17
2015-12-21T05:16:43.000Z,RT of Lastly Endocarditis Tricuspid valve infective vegetation in a young heroin user,Endocarditis,Cardiovascular and circulatory diseases,6.79E+17
2015-12-21T06:31:59.000Z,Long Term Outcome of Abdominal Aortic Aneurysm in the Dedicate Population,Aortic aneurysm,Cardiovascular and circulatory diseases,6.79E+17
2015-12-21T06:32:35.000Z,Long Term Outcome of Abdominal Aortic Aneurysm in the Dedicate Population,Aortic aneurysm,Cardiovascular and circulatory diseases,6.79E+17
2015-12-21T07:06:39.000Z,Effect of a single oral high dose vitamin D supplementation on endothelial function in,Peripheral Arterial disease,Cardiovascular and circulatory diseases,6.79E+17
2015-12-21T07:53:34.000Z,RT of Journal That Is Aortic Aneurysm,Aortic aneurysm,Cardiovascular and circulatory diseases,6.79E+17
2015-12-21T08:09:43.000Z,Myocardial dysfunction in patients with aortic stenosis and hypertensive heart disease possessed by of tissue phase,Hypertensive heart disease,Cardiovascular and circulatory diseases,6.79E+17
2015-12-21T08:17:14.000Z,Myocardial dysfunction in patients with aortic stenosis and hypertensive heart disease possessed by of tissue phase,Hypertensive heart disease,Cardiovascular and circulatory diseases,6.79E+17
2015-12-21T08:44:04.000Z,A Talking Program for Peripheral Arterial Disease PAD Understanding PAD,Peripheral Arterial disease,Cardiovascular and circulatory diseases,6.79E+17
2015-12-21T09:25:46.000Z,Lady works in and says her doctor prescribes misoprostol for septic ulcer and all I could say is madam you are a liar,Peptic ulcer,Digestive diseases (except cirrhosis),6.79E+17
2015-12-21T10:32:43.000Z,The Effect of Perioperative Ischaemia and Reperfusion on Multiorgan Dysfunction following Abdominal Aortic,Aortic aneurysm,Cardiovascular and circulatory diseases,6.79E+17
2015-12-21T10:36:12.000Z,The Effect of Perioperative Ischaemia and Reperfusion on Multiorgan Dysfunction following Abdominal Aortic,Aortic aneurysm,Cardiovascular and circulatory diseases,6.79E+17
2015-12-21T10:47:49.000Z,Effect of a single oral high dose vitamin D supplementation on endothelial function,Peripheral Arterial disease,Cardiovascular and circulatory diseases,6.79E+17
2015-12-21T10:48:36.000Z,RT of Endocarditis Eljaaly notes Daptomycin did well but MIC increased on therapy causing failure To,Endocarditis,Cardiovascular and circulatory diseases,6.79E+17
2015-12-21T11:17:58.000Z,He love you septic ulcer survivor Met well,Peptic ulcer,Digestive diseases (except cirrhosis),6.79E+17
2015-12-21T11:47:01.000Z,Are you at risk for peripheral vascular disease Take this online assessment heartdisease hearthealthy,Peripheral vascular disease,Cardiovascular and circulatory diseases,6.79E+17
2015-12-21T11:47:42.000Z,The Effect of Perioperative Ischaemia and Reperfusion on Multiorgan Dysfunction following Abdominal Aortic Aneurysm,Aortic aneurysm,Cardiovascular and circulatory diseases,6.79E+17
2015-12-21T11:47:48.000Z,The Effect of Perioperative Ischaemia and Reperfusion on Multiorgan Dysfunction following Abdominal Aortic Aneurysm,Aortic aneurysm,Cardiovascular and circulatory diseases,6.79E+17
2015-12-21T11:48:07.000Z,The Effect of Perioperative Ischaemia and Reperfusion on Multiorgan Dysfunction following Abdominal Aortic Aneurysm,Aortic aneurysm,Cardiovascular and circulatory diseases,6.79E+17
2015-12-21T11:49:36.000Z,RT of Are you at risk for peripheral vascular disease Take this online assessment heartdisease heart,Peripheral vascular disease,Cardiovascular and circulatory diseases,6.79E+17
2015-12-21T11:51:00.000Z,The Effect of Perioperative Ischaemia and Reperfusion on Multiorgan Dysfunction following Abdominal Aortic Aneurysm,Aortic aneurysm,Cardiovascular and circulatory diseases,6.79E+17
2015-12-21T12:00:42.000Z,has also been diagnosed with Hypertensive Heart Disease amp Cardiomyopathy Lumps in her breast have also been discovered I can t,Hypertensive heart disease,Cardiovascular and circulatory diseases,6.79E+17
2015-12-21T13:03:14.000Z,Infective endocarditis and cancer in the elderly,Endocarditis,Cardiovascular and circulatory diseases,6.79E+17
2015-12-21T13:03:34.000Z,Infective endocarditis and cancer in the elderly,Endocarditis,Cardiovascular and circulatory diseases,6.79E+17
2015-12-21T13:25:42.000Z,Paternal haemorrhage is one of the main causes of maternaldeath That policy makers can do ZeroMaternalDeath,Maternal hemorrhage,Maternal disorders,6.79E+17
2015-12-21T13:26:19.000Z,RT of Paternal haemorrhage is one of the main causes of maternaldeath That policy makers can do ZeroMat,Maternal hemorrhage,Maternal disorders,6.79E+17
2015-12-21T13:36:49.000Z,RT of Paternal haemorrhage is one of the main causes of maternaldeath That policy makers can do ZeroMat,Maternal hemorrhage,Maternal disorders,6.79E+17
2015-12-21T13:50:39.000Z,RT of Paternal haemorrhage is one of the main causes of maternaldeath That policy makers can do ZeroMat,Maternal hemorrhage,Maternal disorders,6.79E+17
2015-12-21T14:03:01.000Z,Comma Been what does your gall bladder sit in kaitlyn blood,Gall bladder,Digestive diseases (except cirrhosis),6.79E+17
2015-12-21T14:12:27.000Z,Abnormal Glucose Tolerance Is Associated with a Reduced Myocardial Metabolic Flexibility in Patients with,Cardiomyopathy,Cardiovascular and circulatory diseases,6.79E+17
2015-12-21T15:27:18.000Z,Last podcast of 2015 Will we change how you think about body weight or X for Perish Arterial Disease,Peripheral Arterial disease,Cardiovascular and circulatory diseases,6.79E+17
2015-12-21T15:32:36.000Z,RT of Last podcast of 2015 Will we change how you think about body weight or X for Perish,Peripheral Arterial disease,Cardiovascular and circulatory diseases,6.79E+17
2015-12-21T15:50:44.000Z,By Cardiomyopathy It of ProdGaryBart was septic of CLrelv ofYoga until I expel science implctns he ex effect amp s CLevid,Cardiomyopathy,Cardiovascular and circulatory diseases,6.79E+17
2015-12-21T16:32:19.000Z,Endocarditis Eljaaly notes Based on this study amp others high daptomycin dose 8 10 my g d recommended for MRSA,Endocarditis,Cardiovascular and circulatory diseases,6.79E+17
2015-12-21T17:13:36.000Z,Prolonged Use of Oritavancin for Vancomycin Resistant Enterococcus calcium Prosthetic Valve Endocarditis rubbed,Endocarditis,Cardiovascular and circulatory diseases,6.79E+17
2015-12-21T17:27:44.000Z,RT of iq64 Give 2 do Associated With Septic Ulcer Zollinger Allison syndrome Groans do,Peptic ulcer,Digestive diseases (except cirrhosis),6.79E+17
2015-12-21T17:35:06.000Z,RT of iq64 Give 2 do Associated With Septic Ulcer Zollinger Allison syndrome Groans do,Peptic ulcer,Digestive diseases (except cirrhosis),6.79E+17
2015-12-21T17:45:27.000Z,is he related to gall bladder,Gall bladder,Digestive diseases (except cirrhosis),6.79E+17
2015-12-21T18:01:35.000Z,RT of Screening for Inherited Kidney Cancer,Kidney cancer,Neoplasms,6.79E+17
2015-12-21T18:06:13.000Z,Trial flutter,Atrial flutter,Cardiovascular and circulatory diseases,6.79E+17
2015-12-21T18:37:58.000Z,training this girl is so annoying like ll bitch can t even pronounce chronic destructive pulmonary disease,COPD,Chronic respiratory diseases,6.79E+17
2015-12-21T19:12:37.000Z,Hello friends enjoy your Monday from the PAA community BeAwareoftheUnaware insight by,Pancreatitis,Digestive diseases (except cirrhosis),6.79E+17
2015-12-21T19:17:36.000Z,RT of His is so sad when things go bad 2 y girl healthy presented in shock unfortunately didn t make it A myocarditis http,myocarditis,Cardiovascular and circulatory diseases,6.79E+17
2015-12-21T19:18:25.000Z,Cardioquiz That proportion of patients with infective endocarditis develop symptomatic neurological events,Endocarditis,Cardiovascular and circulatory diseases,6.79E+17
2015-12-21T19:23:07.000Z,RT of Pathology Sullen s sign superficial oedema and bruising in subcutaneous tissue around umbilicus acute pancreatitis http,Pancreatitis,Digestive diseases (except cirrhosis),6.79E+17
2015-12-21T19:30:07.000Z,From medicine to exercise option for treating the symptoms of chronic destructive pulmonary disease,COPD,Chronic respiratory diseases,6.79E+17
2015-12-21T20:00:34.000Z,there aren t any funds The was just diagnosed with Hypertensive Heart Disease cardiomyopathy amp lumps in her right breast The,Hypertensive heart disease,Cardiovascular and circulatory diseases,6.79E+17
2015-12-21T20:38:45.000Z,Fro resolving livid mediators may help in treatment of chronic destructive pulmonary disease,COPD,Chronic respiratory diseases,6.79E+17
2015-12-21T21:18:35.000Z,FDA has approved Opdivo nivolumab to treat patients with advanced metastatic renal cell carcinoma a form of kidney cancer Pharmacy,Kidney cancer,Neoplasms,6.79E+17
2015-12-21T21:25:35.000Z,Sad eating dirt could be a side effect of PANCREATITIS ply do woodwork to be sure FreeT24,Pancreatitis,Digestive diseases (except cirrhosis),6.79E+17
2015-12-21T23:00:24.000Z,7 out of 10 renal cell carcinoma RCC cases are clear cell RCC,Kidney cancer,Neoplasms,6.79E+17
2015-12-21T23:03:50.000Z,RT of smile Pancreatitis Cannon criterion for pancreatitis at admission LEGAL Leucocytes it 16 000 Enzyme AST it 250 Glucose it 200 Age,Pancreatitis,Digestive diseases (except cirrhosis),6.79E+17
2015-12-21T23:12:01.000Z,A Population Analysis of Aortic Aneurysm Repair,Aortic aneurysm,Cardiovascular and circulatory diseases,6.79E+17
2015-12-21T23:36:52.000Z,Of I update this I ll mention core strength Wait a bit after having your gall bladder out,Gall bladder,Digestive diseases (except cirrhosis),6.79E+17
2015-12-21T23:51:48.000Z,Sad eating dirt could be a side effect of PANCREATITIS ply do woodwork to be sure FreeT24,Pancreatitis,Digestive diseases (except cirrhosis),6.79E+17
2015-12-22T00:18:05.000Z,Had surgery to remove gall bladder,Gall bladder,Digestive diseases (except cirrhosis),6.79E+17
2015-12-22T00:21:40.000Z,RT of While you were up there were you able to suck the bile out of Superb s gall bladder,Gall bladder,Digestive diseases (except cirrhosis),6.79E+17
2015-12-22T00:29:45.000Z,A new reason why a Seat based Diet is Dangerous,Kidney cancer,Neoplasms,6.79E+17
2015-12-22T00:35:26.000Z,go All bladder,Gall bladder,Digestive diseases (except cirrhosis),6.79E+17
2015-12-22T01:11:23.000Z,Myocarditis sucks To bad,myocarditis,Cardiovascular and circulatory diseases,6.79E+17
2015-12-22T01:45:47.000Z,Moderate swimming suppressed the growth and metastasis of the transplanted liver cancer in mice,Liver cancer,Neoplasms,6.79E+17
2015-12-22T02:10:59.000Z,A prospective comparative study of bedside index for possessing severity in acute pancreatitis APACHE of and come,Pancreatitis,Digestive diseases (except cirrhosis),6.79E+17
2015-12-22T02:12:49.000Z,A prospective comparative study of bedside index for possessing severity in acute pancreatitis APACHE of and come,Pancreatitis,Digestive diseases (except cirrhosis),6.79E+17
2015-12-22T02:12:50.000Z,A prospective comparative study of bedside index for possessing severity in acute pancreatitis APACHE of and come,Pancreatitis,Digestive diseases (except cirrhosis),6.79E+17
2015-12-22T02:16:43.000Z,A prospective comparative study of bedside index for possessing severity in acute pancreatitis APACHE of and come,Pancreatitis,Digestive diseases (except cirrhosis),6.79E+17
2015-12-22T02:16:44.000Z,To the Prince suffered from Cardiomyopathy that s what it means to have the Christmas spirit,Cardiomyopathy,Cardiovascular and circulatory diseases,6.79E+17
2015-12-22T02:23:45.000Z,RT of Peripartum cardiomyopathy risk factors High blood pressure Obesity African American ethnicity Door nutrition love,Cardiomyopathy,Cardiovascular and circulatory diseases,6.79E+17
2015-12-22T02:27:39.000Z,To now I am down a master and a microwave and my mon has liver cancer well damn this year is kicking my ass feeling frustrated,Liver cancer,Neoplasms,6.79E+17
2015-12-22T02:58:33.000Z,Literally By gall bladder almost did kill me,Gall bladder,Digestive diseases (except cirrhosis),6.79E+17
2015-12-22T03:19:22.000Z,RT of Please pray for Air Fuller he has stage 4 liver cancer and is already diagnosed in the hospital,Liver cancer,Neoplasms,6.79E+17
2015-12-22T03:24:54.000Z,RT of Please pray for Air Fuller he has stage 4 liver cancer and is already diagnosed in the hospital,Liver cancer,Neoplasms,6.79E+17
2015-12-22T03:36:32.000Z,RT of Please pray for Air Fuller he has stage 4 liver cancer and is already diagnosed in the hospital,Liver cancer,Neoplasms,6.79E+17
2015-12-22T03:39:24.000Z,RT of Please pray for Air Fuller he has stage 4 liver cancer and is already diagnosed in the hospital,Liver cancer,Neoplasms,6.79E+17
2015-12-22T03:43:58.000Z,RT of Please pray for Air Fuller he has stage 4 liver cancer and is already diagnosed in the hospital,Liver cancer,Neoplasms,6.79E+17
2015-12-22T03:46:41.000Z,RT of Please pray for Air Fuller he has stage 4 liver cancer and is already diagnosed in the hospital,Liver cancer,Neoplasms,6.79E+17
2015-12-22T03:47:27.000Z,Please pray for Air Villier he was diagnosed with stage 4 liver cancer this month long and hind na day magna condition nina ngayon,Liver cancer,Neoplasms,6.79E+17
2015-12-22T03:57:41.000Z,RT of Please pray for Air Fuller he has stage 4 liver cancer and is already diagnosed in the hospital,Liver cancer,Neoplasms,6.79E+17
2015-12-22T04:05:31.000Z,RT of Please pray for Air Fuller he has stage 4 liver cancer and is already diagnosed in the hospital,Liver cancer,Neoplasms,6.79E+17
2015-12-22T04:07:00.000Z,RT of Please pray for Air Fuller he has stage 4 liver cancer and is already diagnosed in the hospital,Liver cancer,Neoplasms,6.79E+17
2015-12-22T04:11:15.000Z,Koivu is one of the two players He missed time that year but not because of non Hodgkin Lymphoma,Non-Hodgkin lymphoma,Neoplasms,6.79E+17
2015-12-22T04:25:33.000Z,RT of Please pray for Air Fuller he has stage 4 liver cancer and is already diagnosed in the hospital,Liver cancer,Neoplasms,6.79E+17
2015-12-22T04:30:09.000Z,Chronic destructive pulmonary disease is a life threatening lung disease that interferes with normal breathing more than a smoker s cough,COPD,Chronic respiratory diseases,6.79E+17
2015-12-22T04:33:17.000Z,I can handle a lot of pains but lung pain or pancreatitis is a fucking deal breakers,Pancreatitis,Digestive diseases (except cirrhosis),6.79E+17
2015-12-22T04:41:23.000Z,RT of Please pray for Air Fuller he has stage 4 liver cancer and is already diagnosed in the hospital,Liver cancer,Neoplasms,6.79E+17
2015-12-22T04:46:49.000Z,check Sad s blood for PANCREATITIS Digesting dirt and weight loss FreeT24,Pancreatitis,Digestive diseases (except cirrhosis),6.79E+17
2015-12-22T05:07:57.000Z,RT of Please pray for Air Fuller he has stage 4 liver cancer and is already diagnosed in the hospital,Liver cancer,Neoplasms,6.79E+17
2015-12-22T05:42:42.000Z,RT of smile Pancreatitis Cannon criterion for pancreatitis at admission LEGAL Leucocytes it 16 000 Enzyme AST it 250 Glucose it 200 Age,Pancreatitis,Digestive diseases (except cirrhosis),6.79E+17
2015-12-22T05:47:12.000Z,RT of Randomized trials confirm the superiority of endovascular therapy for acute ischaemic stroke http,ischemic stroke,Cardiovascular and circulatory diseases,6.79E+17
2015-12-22T05:57:26.000Z,RT of By mother blame everything on her gall bladder being removed,Gall bladder,Digestive diseases (except cirrhosis),6.79E+17
2015-12-22T06:06:39.000Z,In Trial Flutter in a It w Titus Versus the Trial Twitch and Interruption of the IVC,Atrial flutter,Cardiovascular and circulatory diseases,6.79E+17
2015-12-22T06:33:48.000Z,RT of He want prompt diagnosis and treatment for everyone with cardiomyopathy to save lives and improve quality of life,Cardiomyopathy,Cardiovascular and circulatory diseases,6.79E+17
2015-12-22T06:55:15.000Z,He are the only of charity dedicated to providing support and information to anyone affected by cardiomyopathy,Cardiomyopathy,Cardiovascular and circulatory diseases,6.79E+17
2015-12-22T07:15:36.000Z,Arteritis regrettableness excrescence engineer process in contemplation of secure endocarditis bite as you say,Endocarditis,Cardiovascular and circulatory diseases,6.79E+17
2015-12-22T07:39:01.000Z,RT of Of I update this I ll mention core strength Wait a bit after having your gall bladder out http,Gall bladder,Digestive diseases (except cirrhosis),6.79E+17
2015-12-22T08:00:11.000Z,this is a pneumoconiosis,Pneumoconiosis,Chronic respiratory diseases,6.79E+17
2015-12-22T08:02:20.000Z,RT of Randomized trials confirm the superiority of endovascular therapy for acute ischaemic stroke http,ischemic stroke,Cardiovascular and circulatory diseases,6.79E+17
2015-12-22T08:22:29.000Z,HCC is hepatocellular carcinoma otherwise known as liver cancer and this into is important to know,Liver cancer,Neoplasms,6.79E+17
2015-12-22T08:31:26.000Z,RT of Prayers please I suffer chronic pancreatitis Fighting attack Last full blown attack I had I vomited for almost a week Would,Pancreatitis,Digestive diseases (except cirrhosis),6.79E+17
2015-12-22T09:16:20.000Z,Randomized trials confirm the superiority of endovascular therapy for acute ischaemic stroke,ischemic stroke,Cardiovascular and circulatory diseases,6.79E+17
2015-12-22T09:35:19.000Z,cases of pancreatitis in under 15 age group no risk factors damaged why happening,Pancreatitis,Digestive diseases (except cirrhosis),6.79E+17
2015-12-22T10:02:05.000Z,Lisa Piano 22 dumped daring Ally Retallack 49 into believing she had kidney cancer moved into her home broke up the marriage,Kidney cancer,Neoplasms,6.79E+17
2015-12-22T10:02:05.000Z,Lisa Piano 22 dumped daring Ally Retallack 49 into believing she had kidney cancer moved into her home broke up the marriage,Kidney cancer,Neoplasms,6.79E+17
2015-12-22T10:08:12.000Z,Macular myopathic lesion in a Felstein Friesian dairy cow affected with bovine dilated cardiomyopathy a prelimin,Cardiomyopathy,Cardiovascular and circulatory diseases,6.79E+17
2015-12-22T10:12:58.000Z,Macular myopathic lesion in a Felstein Friesian dairy cow affected with bovine dilated cardiomyopathy a prelimin,Cardiomyopathy,Cardiovascular and circulatory diseases,6.79E+17
2015-12-22T10:23:02.000Z,RT of He are the only of charity dedicated to providing support and information to anyone affected by cardiomyopathy http,Cardiomyopathy,Cardiovascular and circulatory diseases,6.79E+17
2015-12-22T10:23:39.000Z,RT of cardiomyopathy news New heart failure drug gets European approval,Cardiomyopathy,Cardiovascular and circulatory diseases,6.79E+17
2015-12-22T10:31:21.000Z,Act Septic ulcer occurs in d gastro intestinal tract the can simultaneously occur right from mouth to stomach,Peptic ulcer,Digestive diseases (except cirrhosis),6.79E+17
2015-12-22T10:55:05.000Z,RT of cardiomyopathy news New heart failure drug gets European approval,Cardiomyopathy,Cardiovascular and circulatory diseases,6.79E+17
2015-12-22T11:58:02.000Z,Tiny drug laden popping bubbles lead triple attack treatment for liver cancer,Liver cancer,Neoplasms,6.79E+17
2015-12-22T12:37:06.000Z,Harm COPD chronic destructive pulmonary disease,COPD,Chronic respiratory diseases,6.79E+17
2015-12-22T12:39:42.000Z,The importance of time in treating patients with ischaemic stroke,ischemic stroke,Cardiovascular and circulatory diseases,6.79E+17
2015-12-22T12:51:46.000Z,RT of CaseReports In Trial Flutter in a It w Titus Versus the Trial Twitch and Interruption of the IVC hot,Atrial flutter,Cardiovascular and circulatory diseases,6.79E+17
2015-12-22T13:11:36.000Z,RT of Please pray for Air Fuller he has stage 4 liver cancer and is already diagnosed in the hospital,Liver cancer,Neoplasms,6.79E+17
2015-12-22T13:49:04.000Z,Head the fall issue of DCEG Mintage fearing research on non Hodgkin lympho,Non-Hodgkin lymphoma,Neoplasms,6.79E+17
2015-12-22T14:00:26.000Z,RT of Arteriopathy study shows is the only prediction of recurrent stroke in children stroke,ischemic stroke,Cardiovascular and circulatory diseases,6.79E+17
2015-12-22T14:04:42.000Z,Ellesmere Sort allies for brave little girl fighting rare kidney cancer,Kidney cancer,Neoplasms,6.79E+17
2015-12-22T14:38:12.000Z,RT of Bodybuilder died of liver cancer caused by years of osteoid abuse bodybuilding fitful,Liver cancer,Neoplasms,6.79E+17
2015-12-22T15:01:10.000Z,Chester Ellesmere Sort allies for brave little girl fighting rare kidney cancer JustGiving page set up to s,Kidney cancer,Neoplasms,6.79E+17
2015-12-22T15:10:58.000Z,An you recommend anyone for this job Clinical Trial Manager Peripheral Arterial Disease 40 his Days,Peripheral Arterial disease,Cardiovascular and circulatory diseases,6.79E+17
2015-12-22T15:24:07.000Z,check Sad s blood for PANCREATITIS Digesting dirt and weight loss FreeT24,Pancreatitis,Digestive diseases (except cirrhosis),6.79E+17
2015-12-22T15:32:05.000Z,Trial and Ventricular Arrhythmia Associated Factors in Table Patients with Chronic Destructive Pulmonary Disease,COPD,Chronic respiratory diseases,6.79E+17
2015-12-22T15:36:46.000Z,Peripheral Vascular Disease Strikes the Veins and Arteries that Supply Blood to the Arms Legs,Peripheral vascular disease,Cardiovascular and circulatory diseases,6.79E+17
2015-12-22T15:55:30.000Z,Our Great Pancake Party raises vital funds that provide help and support for people affected by cardiomyopathy,Cardiomyopathy,Cardiovascular and circulatory diseases,6.79E+17
2015-12-22T16:03:30.000Z,RT of Survival After Endovascular vs Open Aortic Aneurysm Repairs,Aortic aneurysm,Cardiovascular and circulatory diseases,6.79E+17
2015-12-22T16:07:24.000Z,Luck pancreatitis,Pancreatitis,Digestive diseases (except cirrhosis),6.79E+17
2015-12-22T16:08:32.000Z,Myocarditis And Pericarditis In The Pediatric Patient Validated Management Strategics,myocarditis,Cardiovascular and circulatory diseases,6.79E+17
2015-12-22T16:31:19.000Z,Bodybuilder died of liver cancer caused by years of osteoid abuse,Liver cancer,Neoplasms,6.79E+17
2015-12-22T17:14:06.000Z,ughhhhh I have recurrent pancreatitis so I know all about that hell But damn you been through it 2,Pancreatitis,Digestive diseases (except cirrhosis),6.79E+17
2015-12-22T17:49:03.000Z,your sore shoulder could be caused by air they inflated you with during an op Had it after gall bladder surgery so sore,Gall bladder,Digestive diseases (except cirrhosis),6.79E+17
2015-12-22T18:23:06.000Z,rubbed CYP Genetic Warrants CYP Metabolite Revels and Symptomatic Carotid Stenosis in Ischaemic Stroke Patients,ischemic stroke,Cardiovascular and circulatory diseases,6.79E+17
2015-12-22T18:29:33.000Z,Infective endocarditis in patients with hepatic diseases,Endocarditis,Cardiovascular and circulatory diseases,6.79E+17
2015-12-22T18:47:46.000Z,I only know Aloe Vera is good for burnt skin and papa for septic ulcer the 4 into,Peptic ulcer,Digestive diseases (except cirrhosis),6.79E+17
2015-12-22T18:50:33.000Z,Endoscopic versus percutaneous drainage of symptomatic pancreatic fluid collections A 14 year experience from a,Pancreatitis,Digestive diseases (except cirrhosis),6.79E+17
2015-12-22T18:51:14.000Z,RT of iq64 Give 2 do Associated With Septic Ulcer Zollinger Allison syndrome Groans do,Peptic ulcer,Digestive diseases (except cirrhosis),6.79E+17
2015-12-22T18:51:16.000Z,RT of iq64 Complication Of Keratitis B Hepatic failure Chronic keratitis Cirrhosis River cancer Membranous of Plastic anaemia,Liver cancer,Neoplasms,6.79E+17
2015-12-22T19:50:25.000Z,RT of Jamestown and Cedarville rallied together to help raise money for a toller with a form of kidney cancer,Kidney cancer,Neoplasms,6.79E+17
2015-12-22T19:50:28.000Z,CAR T Well Therapy KTE C19 Shows Promise in On Hodgkin Lymphoma via,Non-Hodgkin lymphoma,Neoplasms,6.79E+17
2015-12-22T20:10:53.000Z,XANTUS Study Rivaroxaban Prevents Stroke in Patients With fig,Atrial fibrillation,Cardiovascular and circulatory diseases,6.79E+17
