time,text,topic,group,id
2015-12-26T19:55:16.000Z,That is NVAF or non valvular trial fibrillation,Atrial fibrillation,Cardiovascular and circulatory diseases,6.81E+17
2015-12-26T19:57:03.000Z,A Protocol for the Use of Remotely Supervised Transcranial Direct Current Stimulation tDCS in Multiple Sclerosis,multiple sclerosis,Neurological disorders,6.81E+17
2015-12-26T19:57:56.000Z,Swordsman wife s friends husband at 50 had prostate cancer asked them and she said just cut it out WTF,Prostate cancer,Neoplasms,6.81E+17
2015-12-26T19:59:25.000Z,That is Prostate Cancer Information Signs Causes Stages health,Prostate cancer,Neoplasms,6.81E+17
2015-12-26T20:01:49.000Z,Ireland family hopes their son s life will be changed by of connais treatment Epilepsy,Epilepsy,Neurological disorders,6.81E+17
2015-12-26T20:02:17.000Z,Cannabis oil significantly reduce seizures among child epilepsy patients MME epilepsy,Epilepsy,Neurological disorders,6.81E+17
2015-12-26T20:02:36.000Z,A Protocol for the Use of Remotely Supervised Transcranial Direct Current Stimulation tDCS in Multiple Sclerosis,multiple sclerosis,Neurological disorders,6.81E+17
2015-12-26T20:03:25.000Z,RT of New discovery may soon make prostate cancer cells easier to destroy health world,Prostate cancer,Neoplasms,6.81E+17
2015-12-26T20:05:18.000Z,By West Kidney At Good Guide were s West At Good Guide for Kidney Disease via,kidney disease,"Diabetes, urogenital, blood, and endocrine diseases",6.81E+17
2015-12-26T20:06:50.000Z,RT of River cancer 2016 From immunotherapy to gene therapy and beyond,Liver cancer,Neoplasms,6.81E+17
2015-12-26T20:07:30.000Z,RT of Remembrance Celebration Prevention For the countless lives affected by HIV AIDS this WorldAIDSDay is for you http,HIV/AIDS,HIV/AIDS and tuberculosis,6.81E+17
2015-12-26T20:09:28.000Z,epilepsy migrate warning for The Force Wakens neverstopsatall reitakishima ironicdavestrider I,Epilepsy,Neurological disorders,6.81E+17
2015-12-26T20:11:27.000Z,Vol Vol I am a Of Holiday Buy Sinus Tuberculosis happy sad bless tired rejoice improvement,Tuberculosis,HIV/AIDS and tuberculosis,6.81E+17
2015-12-26T20:11:57.000Z,Advaxis and income announce da clearance of investigation new drug application for p,Cervical cancer,Neoplasms,6.81E+17
2015-12-26T20:12:04.000Z,Prevalence and creditors of asymmetric hypertensive heart disease insight from cardiac and aortic function with,Hypertensive heart disease,Cardiovascular and circulatory diseases,6.81E+17
2015-12-26T20:12:09.000Z,Treatment for pancreatic cancer depends on a number of factors,Pancreatic cancer,Neoplasms,6.81E+17
2015-12-26T20:14:34.000Z,RT of Candid Linked To Arthritis of Psoriasis amp Autoimmune Conditions via health,multiple sclerosis,Neurological disorders,6.81E+17
2015-12-26T20:18:01.000Z,India Adds more Cancer HIV AIDS Drugs to Essential Medicines List MUMBAI India has revised its list of less,HIV/AIDS,HIV/AIDS and tuberculosis,6.81E+17
2015-12-26T20:18:12.000Z,RT of In children acute lymphoblastic leukaemia and Brain Rumors are most common except in Africa where non Hodgkin lympho,Non-Hodgkin lymphoma,Neoplasms,6.81E+17
2015-12-26T20:20:22.000Z,RT of New drug is first to treat progressive multiple sclerosis By,multiple sclerosis,Neurological disorders,6.81E+17
2015-12-26T20:20:58.000Z,A new treatment for multiple sclerosis The drug has dramatic effects on relapsing of,multiple sclerosis,Neurological disorders,6.81E+17
2015-12-26T20:23:52.000Z,Real Your Kidney Disease Reverse your impaired kidney function avoid analysis and begin,kidney disease,"Diabetes, urogenital, blood, and endocrine diseases",6.81E+17
2015-12-26T20:25:42.000Z,Sole of survivor bias in pancreatic cancer case control studies CONCLUSIONS The findings suggested that was,Pancreatic cancer,Neoplasms,6.81E+17
2015-12-26T20:27:38.000Z,RT of A genetic change the Philadelphia chromosome is common in chronic myelogenous leukaemia hot,Leukemia,Neoplasms,6.81E+17
2015-12-26T20:28:01.000Z,Preparing for an of Glare via,multiple sclerosis,Neurological disorders,6.81E+17
2015-12-26T20:28:18.000Z,RT of New study shows plant based dies improve survival in patients with chronic kidney disease,kidney disease,"Diabetes, urogenital, blood, and endocrine diseases",6.81E+17
2015-12-26T20:29:49.000Z,it reaches us to be morally upright n it waste our life away Of pale are morally upright HIV AIDS and other STDS won t be here,HIV/AIDS,HIV/AIDS and tuberculosis,6.81E+17
2015-12-26T20:29:49.000Z,Jerking off regularly helps prevent prostate cancer fact,Prostate cancer,Neoplasms,6.81E+17
2015-12-26T20:30:29.000Z,RT of papers Rubbed Knights into the Sole of microRNAs in Pancreatic Cancer Pathogenesis Potential for Diagnosis Prognosis http,Pancreatic cancer,Neoplasms,6.81E+17
2015-12-26T20:31:54.000Z,RT of up PHEin2015 In January we published a strategy with to tackle tuberculosis,Tuberculosis,HIV/AIDS and tuberculosis,6.81E+17
2015-12-26T20:33:20.000Z,thanks for sharing Epilepsy Foundation have a great Saturday insight by,Epilepsy,Neurological disorders,6.81E+17
2015-12-26T20:34:50.000Z,Preparing for an of Glare,multiple sclerosis,Neurological disorders,6.81E+17
2015-12-26T20:39:37.000Z,RT of Same goes for men with prostate cancer,Prostate cancer,Neoplasms,6.81E+17
2015-12-26T20:41:11.000Z,Historian Diseases Like Measles and Tuberculosis on the Rise in England Historian rise,Tuberculosis,HIV/AIDS and tuberculosis,6.81E+17
2015-12-26T20:41:14.000Z,A new treatment for multiple sclerosis The drug has dramatic effects on Salon along new treatment fo,multiple sclerosis,Neurological disorders,6.81E+17
2015-12-26T20:41:26.000Z,HIV Lids is not even Totally over yet and there s already a new virus Ladies and Gentlemen the Superbug,HIV/AIDS,HIV/AIDS and tuberculosis,6.81E+17
2015-12-26T20:41:59.000Z,Overcoming Multiple Sclerosis Improving life with of,multiple sclerosis,Neurological disorders,6.81E+17
2015-12-26T20:47:19.000Z,RT of Clear evidence of Feel toxicity in soda Joke linked fertility thyreoid dysfunction n liver cancer,Liver cancer,Neoplasms,6.81E+17
2015-12-26T20:49:14.000Z,A new treatment for multiple sclerosis The drug has dramatic effects on relapsing of via,multiple sclerosis,Neurological disorders,6.81E+17
2015-12-26T20:49:28.000Z,RT of New drug is first to treat progressive multiple sclerosis By,multiple sclerosis,Neurological disorders,6.81E+17
2015-12-26T20:50:07.000Z,Add flax seeds 2 your foods 2 help improve blood sugar levels protect against breast colon amp prostate cancer amp improve digestion health,Prostate cancer,Neoplasms,6.81E+17
2015-12-26T20:50:19.000Z,Head His Took 3260 The Kidney Disease Solution 75 Commissions,kidney disease,"Diabetes, urogenital, blood, and endocrine diseases",6.81E+17
2015-12-26T20:52:54.000Z,RT of Last night was fucking good,Tuberculosis,HIV/AIDS and tuberculosis,6.81E+17
2015-12-26T20:53:12.000Z,Killjoy HIV Lids is not even Totally over yet and there s already a new virus Ladies and Gentlemen the Superbug,HIV/AIDS,HIV/AIDS and tuberculosis,6.81E+17
2015-12-26T20:53:41.000Z,RT of ICYMI Now animals can give you tuberculosis,Tuberculosis,HIV/AIDS and tuberculosis,6.81E+17
2015-12-26T20:56:03.000Z,RT of Craig Eager interviews Egg Popovich for the first time since returning from Leukaemia and it was awesome,Leukemia,Neoplasms,6.81E+17
2015-12-26T20:56:57.000Z,RT of ICYMI Now animals can give you tuberculosis,Tuberculosis,HIV/AIDS and tuberculosis,6.81E+17
2015-12-26T20:57:20.000Z,Parents find success treating kiss epilepsy cutis with connais oil,Epilepsy,Neurological disorders,6.81E+17
2015-12-26T20:57:44.000Z,elephants can carry human strains of tuberculosis and it s incredibly difficult to treat Met we still force them into room,Tuberculosis,HIV/AIDS and tuberculosis,6.81E+17
2015-12-26T21:02:15.000Z,Oh dear Effective Treatment For Prostate Cancer Doubles the Risks of Alzheimer s Disease Study Shows,Prostate cancer,Neoplasms,6.81E+17
2015-12-26T21:02:34.000Z,RT of it reaches us to be morally upright n it waste our life away Of pale are morally upright HIV AIDS and other STDS,HIV/AIDS,HIV/AIDS and tuberculosis,6.81E+17
2015-12-26T21:02:58.000Z,RT of Hats good my dad died at 54 of leukaemia in Parts,Leukemia,Neoplasms,6.81E+17
2015-12-26T21:05:04.000Z,A new treatment for multiple sclerosis The drug has dramatic effects on relapsing of,multiple sclerosis,Neurological disorders,6.81E+17
2015-12-26T21:05:12.000Z,News HIV CHIRUNDU District has continued to record high cases of HIV AIDS due to some residents involvement,HIV/AIDS,HIV/AIDS and tuberculosis,6.81E+17
2015-12-26T21:07:18.000Z,RT of Blood News Stronger Draft Versus Leukaemia Effect Using HLA Haploidentical Honors than w HLA Identical Willings CXNTop10 http,Leukemia,Neoplasms,6.81E+17
2015-12-26T21:08:56.000Z,RT of A new treatment for multiple sclerosis The drug has dramatic effects on relapsing of Clinical trials,multiple sclerosis,Neurological disorders,6.81E+17
2015-12-26T21:09:00.000Z,RT of Very receiving touchdown supports leukaemia this week by,Leukemia,Neoplasms,6.81E+17
2015-12-26T21:11:16.000Z,RT of A new treatment for multiple sclerosis The drug has dramatic effects on relapsing of,multiple sclerosis,Neurological disorders,6.81E+17
2015-12-26T21:14:03.000Z,Potentially lethal of is usually spread between people but cows and wild animals infected with bovine tuberculosis are also spreading,Tuberculosis,HIV/AIDS and tuberculosis,6.81E+17
2015-12-26T21:15:27.000Z,RT of A new treatment for multiple sclerosis The drug has dramatic effects on relapsing of,multiple sclerosis,Neurological disorders,6.81E+17
2015-12-26T21:19:22.000Z,RT of A new treatment for multiple sclerosis The drug has dramatic effects on relapsing of,multiple sclerosis,Neurological disorders,6.81E+17
2015-12-26T21:19:30.000Z,In this day in 1974 one of the true tetanus of both bedtime radio amp of Back Penny died of pancreatic cancer at age 80,Pancreatic cancer,Neoplasms,6.81E+17
2015-12-26T21:21:07.000Z,RT of Oh dear Effective Treatment For Prostate Cancer Doubles the Risks of Alzheimer s Disease Study Shows,Prostate cancer,Neoplasms,6.81E+17
2015-12-26T21:23:50.000Z,RT of My I thought this was a pick of Tennis Weary with pancreatic cancer,Pancreatic cancer,Neoplasms,6.81E+17
2015-12-26T21:25:28.000Z,Epilepsy is included in mental health services in Tanzania and the high figure of epilepsy,Epilepsy,Neurological disorders,6.81E+17
2015-12-26T21:25:51.000Z,RT of Kissed cancer cells more likely following open radical prostatectomy via medivizor MaleHealth,Prostate cancer,Neoplasms,6.81E+17
2015-12-26T21:26:34.000Z,RT of A new treatment for multiple sclerosis The drug has dramatic effects on relapsing of,multiple sclerosis,Neurological disorders,6.81E+17
2015-12-26T21:26:36.000Z,Scientists Have Round A May To Take Cancer Cells Will Each Other,Leukemia,Neoplasms,6.81E+17
2015-12-26T21:27:45.000Z,RT of Honorable mention for George Clayton Johnson writer of Organs Run Twilight One and Star Are episodes dies at 86 of p,Prostate cancer,Neoplasms,6.81E+17
2015-12-26T21:28:33.000Z,Advantages and spotted psychomotor epilepsy entree campervan fires fQVMdj,Epilepsy,Neurological disorders,6.81E+17
2015-12-26T21:29:15.000Z,I hope your father gets news that he has liver cancer,Liver cancer,Neoplasms,6.81E+17
2015-12-26T21:29:43.000Z,RT of Controversial world of pediatric connais treatment for epilepsy,Epilepsy,Neurological disorders,6.81E+17
2015-12-26T21:32:04.000Z,There s no cure for Cancer HIV AIDS John s disease LiesToldToUs,HIV/AIDS,HIV/AIDS and tuberculosis,6.81E+17
2015-12-26T21:32:45.000Z,Paula Montgomery Young runner s brave battle with of,multiple sclerosis,Neurological disorders,6.81E+17
2015-12-26T21:39:14.000Z,5654 The Complete Guide To Chronic Kidney Disease cry In Dogs Oats,kidney disease,"Diabetes, urogenital, blood, and endocrine diseases",6.81E+17
2015-12-26T21:42:00.000Z,Top Treatments For of,multiple sclerosis,Neurological disorders,6.81E+17
2015-12-26T21:43:03.000Z,9936 The Complete Guide To Chronic Kidney Disease cry In Dogs Oats,kidney disease,"Diabetes, urogenital, blood, and endocrine diseases",6.81E+17
2015-12-26T21:43:59.000Z,A new treatment for multiple sclerosis The drug has dramatic effects on relapsing of via,multiple sclerosis,Neurological disorders,6.81E+17
2015-12-26T21:44:30.000Z,clean of A highly instructive cancer case report w genomics amp drug response http,lung cancer,Neoplasms,6.81E+17
2015-12-26T21:44:58.000Z,I hope you do it pancreatic cancer will hit you in two weeks you did this to yourself maggot,Pancreatic cancer,Neoplasms,6.81E+17
2015-12-26T21:45:09.000Z,RT of The CAP AIDS Network Daily is out Stories via,HIV/AIDS,HIV/AIDS and tuberculosis,6.81E+17
2015-12-26T21:45:34.000Z,ICYMI Now animals can give you tuberculosis,Tuberculosis,HIV/AIDS and tuberculosis,6.81E+17
2015-12-26T21:45:36.000Z,He have a special fact sheet that lists questions to ask your doctor if you receive a ProstateCancer diagnosis,Prostate cancer,Neoplasms,6.81E+17
2015-12-26T21:45:51.000Z,RT of His woman could revolutionize the way Atkinson s disease is diagnosed,Parkinsons disease,Neurological disorders,6.81E+17
2015-12-26T21:49:37.000Z,Predictions New Diagnostic Tools for Prostate Cancer Medical Breakthrough via TechFlavor,Prostate cancer,Neoplasms,6.81E+17
2015-12-26T21:49:55.000Z,RT of Great sweeps 2 FollowFri amp every other day of,HIV/AIDS,HIV/AIDS and tuberculosis,6.81E+17
2015-12-26T21:50:01.000Z,New diagnostic along with new drugs and new vaccines are needed to stop of,Tuberculosis,HIV/AIDS and tuberculosis,6.81E+17
2015-12-26T21:50:09.000Z,RT of of Happy holidays to you too,HIV/AIDS,HIV/AIDS and tuberculosis,6.81E+17
2015-12-26T21:50:54.000Z,A New Marijuana Derivative Would Bring Great News for People With Epilepsy Daily America,Epilepsy,Neurological disorders,6.81E+17
2015-12-26T21:51:46.000Z,RT of i told her that she was too beautiful to cut her skin she told me i was too beautiful for lung cancer this is my last pack,lung cancer,Neoplasms,6.81E+17
2015-12-26T21:52:05.000Z,Migraine then a asthma attack not only can I not see properly i also can t breathe I m basically dead,Asthma,Chronic respiratory diseases,6.81E+17
2015-12-26T21:56:22.000Z,Cannabis oil significantly reduce seizures among child epilepsy patients MME epilepsy,Epilepsy,Neurological disorders,6.81E+17
2015-12-26T21:56:48.000Z,RT of New drug is first to treat progressive multiple sclerosis By,multiple sclerosis,Neurological disorders,6.81E+17
2015-12-26T21:59:06.000Z,New drug to treat blood cancers,Leukemia,Neoplasms,6.81E+17
2015-12-26T21:59:14.000Z,I m a lazy piece of poor I don t have asthma ll,Asthma,Chronic respiratory diseases,6.81E+17
2015-12-26T21:59:29.000Z,RT of Regnery Please pray for my grandfather who was diagnosed with lung cancer today He hasn t smoked in 35 years Fortunate they can,lung cancer,Neoplasms,6.81E+17
2015-12-26T21:59:46.000Z,Marijuana May Smoke But HIV AIDS via sharethis worldaidsday HIV connais marijuana,HIV/AIDS,HIV/AIDS and tuberculosis,6.81E+17
2015-12-26T22:00:40.000Z,ICYMI Weather Draws Cockroaches Indoors Increasing Risk for Allergens amp Asthma Attacks asthma printing,Asthma,Chronic respiratory diseases,6.81E+17
2015-12-26T22:01:03.000Z,RT of Tom Grady grants the wish of a little girl from Ethel with leukaemia Tic courtesy Bailey s Journey Facebook page,Leukemia,Neoplasms,6.81E+17
2015-12-26T22:01:26.000Z,Running broad jump brush unto subscribe to tuberculosis under status que i,Tuberculosis,HIV/AIDS and tuberculosis,6.81E+17
2015-12-26T22:02:34.000Z,I don t care smoke fucking cigarettes but not around me I m not going to get cancer or have an asthma attack for a fucking drug,Asthma,Chronic respiratory diseases,6.81E+17
2015-12-26T22:03:04.000Z,I think I caught asthma I was doing a really intense sport Running,Asthma,Chronic respiratory diseases,6.81E+17
2015-12-26T22:03:30.000Z,159 AIDS organizations urge Congress to restore cuts to domestic HIV AIDS programs Head the letter NoHIVcuts,HIV/AIDS,HIV/AIDS and tuberculosis,6.81E+17
2015-12-26T22:03:54.000Z,RT of Tom Grady grants the wish of a little girl from Ethel with leukaemia Tic courtesy Bailey s Journey Facebook page,Leukemia,Neoplasms,6.81E+17
2015-12-26T22:05:01.000Z,RT of nigyhinudile Smoking And Eight Pain Increases The Death Late From Prostate Cancer,Prostate cancer,Neoplasms,6.81E+17
2015-12-26T22:05:17.000Z,I Had Asthma for 12 Years Until I Round But It Was Cancer conscioushealthsolutions health,Asthma,Chronic respiratory diseases,6.81E+17
2015-12-26T22:05:35.000Z,Search and Rescue Dog Kinds Something VERY Unusual That Saved Her Owner s Life,lung cancer,Neoplasms,6.81E+17
2015-12-26T22:06:07.000Z,RT of of Direct measurement of upper away inflammation in children with chronic rhinosinusitis implication for asthma,Asthma,Chronic respiratory diseases,6.81E+17
2015-12-26T22:06:43.000Z,Early sweet about how having asthma in winter is absolutely white,Asthma,Chronic respiratory diseases,6.81E+17
2015-12-26T22:07:23.000Z,When it comes to chasing pp I have asthma Therefore I cannot Physically professionally emotional socially etcetera etcetera,Asthma,Chronic respiratory diseases,6.81E+17
2015-12-26T22:07:50.000Z,RT of truths 10 signs you may be getting multiple sclerosis,multiple sclerosis,Neurological disorders,6.81E+17
2015-12-26T22:08:32.000Z,Different Types regarding of Multiple Sclerosis q,multiple sclerosis,Neurological disorders,6.81E+17
2015-12-26T22:09:19.000Z,By View Congress takes huge step in the fight against Alzheimer s Rockford Register Star,Alzheimer,Neurological disorders,6.81E+17
2015-12-26T22:09:30.000Z,chest is good most of the time Occasionally I get some deep coughing which causes a test break but not bad I have asthma,Asthma,Chronic respiratory diseases,6.81E+17
2015-12-26T22:09:46.000Z,RT of Of is going to be the GOP nominee he needs a serious medical disclosure His laws suggest he has had post,Prostate cancer,Neoplasms,6.81E+17
2015-12-26T22:11:02.000Z,also suffering from asthma was using an inhaled when went of injured,Asthma,Chronic respiratory diseases,6.81E+17
2015-12-26T22:12:10.000Z,RT of Tom Grady grants the wish of a little girl from Ethel with leukaemia His courtesy Bailey s Journey Facebook page,Leukemia,Neoplasms,6.81E+17
2015-12-26T22:12:35.000Z,RT of Understanding Parkinsons Disease Hart,Parkinsons disease,Neurological disorders,6.81E+17
2015-12-26T22:12:40.000Z,oh I m addicted to their sweet tea too but it s so bad for my kidneys Too kidney disease,kidney disease,"Diabetes, urogenital, blood, and endocrine diseases",6.81E+17
2015-12-26T22:14:58.000Z,EMTHONJENI C2C may Raphael Centre assisted by Emthonjeni Trust runs Sakhingomso School in Grahamstown for HIV AIDS affected children,HIV/AIDS,HIV/AIDS and tuberculosis,6.81E+17
2015-12-26T22:15:18.000Z,A new study has found that a marijuana derivative may be useful for managing epilepsy Credit,Epilepsy,Neurological disorders,6.81E+17
2015-12-26T22:15:22.000Z,with asthma,Asthma,Chronic respiratory diseases,6.81E+17
2015-12-26T22:15:25.000Z,clean of A highly instructive cancer case report w genomics amp drug response http,lung cancer,Neoplasms,6.81E+17
2015-12-26T22:15:32.000Z,Of the 4 deadliest cancers only lungcancer lacks routine screening Now dose of scars may help some,lung cancer,Neoplasms,6.81E+17
2015-12-26T22:15:48.000Z,By grand forgot I was his granddaughter BUT he did remember we were good bodies so Alzheimer s isn t all bad j it s the worst,Alzheimer,Neurological disorders,6.81E+17
2015-12-26T22:17:47.000Z,i ate so much i had to take paracetemol for the pain and now i have asthma christmas,Asthma,Chronic respiratory diseases,6.81E+17
2015-12-26T22:18:12.000Z,blame how many are we down,Asthma,Chronic respiratory diseases,6.81E+17
2015-12-26T22:19:06.000Z,RT of Spread the word Knowing the symptoms of cervicalcancer could save your life plsRT,Cervical cancer,Neoplasms,6.81E+17
2015-12-26T22:19:36.000Z,RT of Tom Grady grants the wish of a little girl from Ethel with leukaemia His courtesy Bailey s Journey Facebook page,Leukemia,Neoplasms,6.81E+17
2015-12-26T22:20:14.000Z,RT of 30 seas to sign please of,Epilepsy,Neurological disorders,6.81E+17
2015-12-26T22:20:15.000Z,Helpful for leukaemia lympho patients Fewer side effects with new drug for fatal folds,Leukemia,Neoplasms,6.81E+17
2015-12-26T22:20:24.000Z,RT of minerals To you think if only i didn t feel tired have eczema suffer from bad asthma minerals are your answer ve,Asthma,Chronic respiratory diseases,6.81E+17
2015-12-26T22:20:33.000Z,I m not chasing you no more I got asthma,Asthma,Chronic respiratory diseases,6.81E+17
2015-12-26T22:21:57.000Z,By great great aunt is roaming around the house Alzheimer s is a hard thing to witness up close,Alzheimer,Neurological disorders,6.81E+17
2015-12-26T22:22:23.000Z,RT of it BARGAIN Love The Notebook Cry Blue Hydrangeas an Alzheimer s love story CR4U All r,Alzheimer,Neurological disorders,6.81E+17
2015-12-26T22:22:30.000Z,RT of Breast Cancer Treatment By Natural Means via,Breast cancer,Neoplasms,6.81E+17
2015-12-26T22:22:55.000Z,RT of Of is going to be the GOP nominee he needs a serious medical disclosure His laws suggest he has had post,Prostate cancer,Neoplasms,6.81E+17
2015-12-26T22:23:16.000Z,RT of Novel Chemical Ashes Way Alzheimer s Plague in Vice,Alzheimer,Neurological disorders,6.81E+17
2015-12-26T22:24:58.000Z,RT of Mutations in genet of the glucose metabolism are associated with risk of fatal prostate cancer,Prostate cancer,Neoplasms,6.81E+17
2015-12-26T22:26:34.000Z,RT of in primary we were asked to write 3 diseases this other guy wrote 1 Iv Lids 2 Cancer 3 Teacher asked what is that re,HIV/AIDS,HIV/AIDS and tuberculosis,6.81E+17
2015-12-26T22:26:47.000Z,RT of Vitamin D added to brain cells boasted myelin producing cells by 80 amp may repair nerve damage in multiple sclerosis he,multiple sclerosis,Neurological disorders,6.81E+17
2015-12-26T22:26:56.000Z,RT of photo raise breastcancer awareness via C Aesthetic plasticsurgery he,Breast cancer,Neoplasms,6.81E+17
2015-12-26T22:27:30.000Z,RT of I wish i had a cut laugh or one of those laughs that make other people laugh but i sound like a hyperventilating walls,Asthma,Chronic respiratory diseases,6.81E+17
2015-12-26T22:28:02.000Z,RT of 3 months until purpleday the global epilepsy day Met s get Google to go purple that day hot,Epilepsy,Neurological disorders,6.81E+17
2015-12-26T22:28:38.000Z,EMS now requested for the operator of the vehicle who struck the cruisers Patrol It reports possible medical epilepsy condition,Epilepsy,Neurological disorders,6.81E+17
2015-12-26T22:28:40.000Z,RT of Williams look man you can t do this I have asthma,Asthma,Chronic respiratory diseases,6.81E+17
2015-12-26T22:28:52.000Z,Thank Congress for Investing in Alzheimer s Research,Alzheimer,Neurological disorders,6.81E+17
2015-12-26T22:29:26.000Z,Did You Took Beyond the Pink His Breast Cancer Awareness Month conscioushealthsolutions health,Breast cancer,Neoplasms,6.81E+17
2015-12-26T22:30:34.000Z,RT of I have lost my hero my enter my teacher of DAD To lung cancer RIPDad,lung cancer,Neoplasms,6.81E+17
2015-12-26T22:30:59.000Z,RT of Researches develop bearable EEG device to record seizure activity epilepsy,Epilepsy,Neurological disorders,6.81E+17
2015-12-26T22:31:02.000Z,Potentially lethal of is usually spread between people but cows and wild animals infected with bovine tuberculosis are also spreading,Tuberculosis,HIV/AIDS and tuberculosis,6.81E+17
2015-12-26T22:31:07.000Z,Slurred or double vision loss of balance difficulty in thinking etc are associated with multiple sclerosis,multiple sclerosis,Neurological disorders,6.81E+17
2015-12-26T22:31:37.000Z,RT of photo raise breastcancer awareness via C Aesthetic plasticsurgery he,Breast cancer,Neoplasms,6.81E+17
2015-12-26T22:31:37.000Z,To the guy who s been building me at work got me medicine for my migrate I knew he was a good person,Migraine,Neurological disorders,6.81E+17
2015-12-26T22:31:59.000Z,His Asthma is killing,Asthma,Chronic respiratory diseases,6.81E+17
2015-12-26T22:32:10.000Z,RT of Tom Grady grants the wish of a little girl from Ethel with leukaemia Tic courtesy Bailey s Journey Facebook page,Leukemia,Neoplasms,6.81E+17
2015-12-26T22:32:15.000Z,RT of Insight With Effects of Masculine Self Esteem Following Treatment for Localised Prostate Cancer among May Men,Prostate cancer,Neoplasms,6.81E+17
2015-12-26T22:32:19.000Z,RT of United WATCH 6 People Discuss Giving With HIV Enigma,HIV/AIDS,HIV/AIDS and tuberculosis,6.81E+17
2015-12-26T22:32:27.000Z,RT of MIAMI Cannabis oil is not about getting high it s about living epilepsy cannabisoil MME,Epilepsy,Neurological disorders,6.81E+17
2015-12-26T22:32:31.000Z,car radio or migrate,Migraine,Neurological disorders,6.81E+17
2015-12-26T22:32:55.000Z,RT of Condoms are trash but you piipii ahahah your asthma come Boa,Asthma,Chronic respiratory diseases,6.81E+17
2015-12-26T22:33:06.000Z,RT of Insight With Effects of Masculine Self Esteem Following Treatment for Localised Prostate Cancer among May Men,Prostate cancer,Neoplasms,6.81E+17
2015-12-26T22:33:44.000Z,RT of Tea officer i have asthma,Asthma,Chronic respiratory diseases,6.81E+17
2015-12-26T22:34:04.000Z,I need to get the appointment for the tuberculosis blood test on monday,Tuberculosis,HIV/AIDS and tuberculosis,6.81E+17
2015-12-26T22:34:22.000Z,Cannabis Would Low Atkinson s Disease Symptoms marijuanahealth,Parkinsons disease,Neurological disorders,6.81E+17
2015-12-26T22:34:58.000Z,Flora Unfortunately some Dogs that Took Perfectly Healthy have SpecialNeeds Epilepsy it Had 1,Epilepsy,Neurological disorders,6.81E+17
2015-12-26T22:35:26.000Z,RT of Well apparently for Christmas I got a migrate and diarrhoea,Migraine,Neurological disorders,6.81E+17
2015-12-26T22:36:01.000Z,RT of epilepsy is for life,Epilepsy,Neurological disorders,6.81E+17
