time,text,topic,group,id
Sun Dec 13 05:45:10 +0000 2015,RT of Pesticide in milk decades ago may be linked to atkinson s disease news teach,Parkinsons disease,Neurological disorders,6.76E+17
Sun Dec 13 05:45:15 +0000 2015,nicole7 ll I know how you do ak I gutta go get my asthma pump room,Asthma,Chronic respiratory diseases,6.76E+17
Sun Dec 13 05:45:53 +0000 2015,New HIV Infections in May AIDS Atlanta Health JonathanMermin Ex,HIV/AIDS,HIV/AIDS and tuberculosis,6.76E+17
Sun Dec 13 05:46:42 +0000 2015,A very interesting study BBC News Suicide gene therapy kills prostate cancer cells,Prostate cancer,Neoplasms,6.76E+17
Sun Dec 13 05:47:02 +0000 2015,I m sure he s got asthma pump define amp amos on stand He might even have Radium by the bucket,Asthma,Chronic respiratory diseases,6.76E+17
Sun Dec 13 05:47:06 +0000 2015,damn I m so sorry I really hope it doesn t turn out to be anything worse than asthma Even then asthma s pretty bad on its own,Asthma,Chronic respiratory diseases,6.76E+17
Sun Dec 13 05:47:16 +0000 2015,350 Infants Possibly Exposed to Tuberculosis by California Hospital Employee,Tuberculosis,HIV/AIDS and tuberculosis,6.76E+17
Sun Dec 13 05:54:18 +0000 2015,RT of News in context Pesticide in milk linked to Parkinsons disease,Parkinsons disease,Neurological disorders,6.76E+17
Sun Dec 13 05:55:43 +0000 2015,Descriptive epidemiology of physical activity rates in multiple sclerosis,multiple sclerosis,Neurological disorders,6.76E+17
Sun Dec 13 05:56:12 +0000 2015,Head s marriage to set designer Heard When on September 8 1940 lasted until his death from prostate cancer in 1979,Prostate cancer,Neoplasms,6.76E+17
Sun Dec 13 05:57:55 +0000 2015,bless of alas Boy When u left U took my breath away Girl Www that s so cut Boy Mute U took my Inhaled I suffer from asthma,Asthma,Chronic respiratory diseases,6.76E+17
Sun Dec 13 05:58:18 +0000 2015,Suicide gene therapy for prostate cancer,Prostate cancer,Neoplasms,6.76E+17
Sun Dec 13 05:58:59 +0000 2015,RT of Common prostate cancer treatment may double Alzheimer s risk Alzheimers Prostate risk,Prostate cancer,Neoplasms,6.76E+17
Sun Dec 13 06:00:28 +0000 2015,damage of 5 year old cancer survivor Yeah Still gave advice to a 14 year old leukaemia patient,Leukemia,Neoplasms,6.76E+17
Sun Dec 13 06:00:59 +0000 2015,COPD Therapy Chronic Destructive Pulmonary Disease Airnergy,COPD,Chronic respiratory diseases,6.76E+17
Sun Dec 13 06:01:24 +0000 2015,RT of Who going into 2016 with no HIV AIDS,HIV/AIDS,HIV/AIDS and tuberculosis,6.76E+17
Sun Dec 13 06:01:57 +0000 2015,RT of Who going into 2016 with no HIV AIDS,HIV/AIDS,HIV/AIDS and tuberculosis,6.76E+17
Sun Dec 13 06:02:27 +0000 2015,Medical refugees leave Texas for marijuana treatments medicalmarijuana MME epilepsy cod,Epilepsy,Neurological disorders,6.76E+17
Sun Dec 13 06:02:37 +0000 2015,AIDS N of launched new plans to dramatically reduce new HIV infections He said the zero new infections zero,HIV/AIDS,HIV/AIDS and tuberculosis,6.76E+17
Sun Dec 13 06:03:44 +0000 2015,ICYMI HIV positive doctor who helped AIDS patients couldn t heal himself To he got a dog that did long,HIV/AIDS,HIV/AIDS and tuberculosis,6.76E+17
Sun Dec 13 06:05:16 +0000 2015,Late Positive STD HIV AIDS single freak An from Brooklyn 31 years personal love dating friendship,HIV/AIDS,HIV/AIDS and tuberculosis,6.76E+17
Sun Dec 13 06:06:57 +0000 2015,Physical activity linked to lower death risk in men with localised prostate cancer,Prostate cancer,Neoplasms,6.76E+17
Sun Dec 13 06:10:11 +0000 2015,aids and his are fraud,HIV/AIDS,HIV/AIDS and tuberculosis,6.76E+17
Sun Dec 13 06:11:36 +0000 2015,350 Infants Possibly Exposed to Tuberculosis by California Hospital Employee,Tuberculosis,HIV/AIDS and tuberculosis,6.76E+17
Sun Dec 13 06:11:49 +0000 2015,Sorry to b personal But we have a State Most 1 Detect I know is still work despite leukaemia amp City Sheriff Posts,Leukemia,Neoplasms,6.76E+17
Sun Dec 13 06:13:37 +0000 2015,I hate being sick bc I start having asthma attacks and they aren t so grm,Asthma,Chronic respiratory diseases,6.76E+17
Sun Dec 13 06:14:54 +0000 2015,Maude Arabian Women March To Note,Leukemia,Neoplasms,6.76E+17
Sun Dec 13 06:16:55 +0000 2015,NRG Oncology RTOG 0415 A Randomized Phase 3 Noninferiority Study Comparing 2 Fractionation Schedules in Patients,Prostate cancer,Neoplasms,6.76E+17
Sun Dec 13 06:17:17 +0000 2015,Outcome According to Elective Pelvic Radiation Therapy in Patients With High Risk Localised Prostate Cancer A,Prostate cancer,Neoplasms,6.76E+17
Sun Dec 13 06:17:19 +0000 2015,New Drug to Right River Fibrosis the Round That Never Heals health cancer,Liver cancer,Neoplasms,6.76E+17
Sun Dec 13 06:19:02 +0000 2015,Head s marriage to set designer Heard When on September 8 1940 lasted until his death from prostate cancer in 1979,Prostate cancer,Neoplasms,6.76E+17
Sun Dec 13 06:20:09 +0000 2015,Asthma attack panic attack there no between they both hurt so much,Asthma,Chronic respiratory diseases,6.76E+17
Sun Dec 13 06:22:01 +0000 2015,New Suicide Gene Therapy Hills Prostate Cancer Cells Effectively Researches at Houston Methodist Hospital ha,Prostate cancer,Neoplasms,6.76E+17
Sun Dec 13 06:23:05 +0000 2015,Morning In epilepsy alarm costs 500 to donate free to a family Would you fundraise for us please,Epilepsy,Neurological disorders,6.76E+17
Sun Dec 13 06:23:09 +0000 2015,A pulmonary function test rules out asthma or emphysema Bronchitis,Asthma,Chronic respiratory diseases,6.76E+17
Sun Dec 13 06:23:50 +0000 2015,i feel like i might actually have an asthma attack,Asthma,Chronic respiratory diseases,6.76E+17
Sun Dec 13 06:24:40 +0000 2015,RT of People who regularly sleep for longer than 10 hours have greater risk of heart disease stroke type 2 diabetes and depress,Diabetes,"Diabetes, urogenital, blood, and endocrine diseases",6.76E+17
Sun Dec 13 06:24:51 +0000 2015,RT of Why Coffee may protect against type 2 diabetes via coffee Health,Diabetes,"Diabetes, urogenital, blood, and endocrine diseases",6.76E+17
Sun Dec 13 06:25:11 +0000 2015,GERD has been linked to pharyngitis chronic cough pulmonary fibrosis earache and asthma even when not clinically apparent AcidReflux,Asthma,Chronic respiratory diseases,6.76E+17
Sun Dec 13 06:25:14 +0000 2015,GeneTherapy Causes Prostate Cancer Cells to He More Visible to the Immune System,Prostate cancer,Neoplasms,6.76E+17
Sun Dec 13 06:25:51 +0000 2015,RT of Next Reverse nutritionally based obesity diabetes cancer dementia epidemic that s crippling health of Planet s souls hot,Diabetes,"Diabetes, urogenital, blood, and endocrine diseases",6.76E+17
Sun Dec 13 06:26:27 +0000 2015,RT of People who regularly sleep for longer than 10 hours have greater risk of heart disease stroke type 2 diabetes and depress,Diabetes,"Diabetes, urogenital, blood, and endocrine diseases",6.76E+17
Sun Dec 13 06:26:38 +0000 2015,with risk factors diabetes smoking etc and positive factors earnings women friends family I got O U 86,Diabetes,"Diabetes, urogenital, blood, and endocrine diseases",6.76E+17
Sun Dec 13 06:27:11 +0000 2015,RT of People who regularly sleep for longer than 10 hours have greater risk of heart disease stroke type 2 diabetes and depress,Diabetes,"Diabetes, urogenital, blood, and endocrine diseases",6.76E+17
Sun Dec 13 06:28:15 +0000 2015,He always talk about meeting and stuff and I always say no because of diabetes I m fucking sick of this shit for fuck sake,Diabetes,"Diabetes, urogenital, blood, and endocrine diseases",6.76E+17
Sun Dec 13 06:28:17 +0000 2015,Donations will allow widow to purchase healthy foods on her strict diabetes diet,Diabetes,"Diabetes, urogenital, blood, and endocrine diseases",6.76E+17
Sun Dec 13 06:29:28 +0000 2015,RT of love care crisis inventor USA please read following story amp give what you can I m helping w lupus epilepsy he,Epilepsy,Neurological disorders,6.76E+17
Sun Dec 13 06:29:32 +0000 2015,Stress precursor to pre Alzheimer s condition in elderly health news alzheimers alzheimerssociety depression diabetes Amnesia,Diabetes,"Diabetes, urogenital, blood, and endocrine diseases",6.76E+17
Sun Dec 13 06:30:02 +0000 2015,RT of People who regularly sleep for longer than 10 hours have greater risk of heart disease stroke type 2 diabetes and depress,Diabetes,"Diabetes, urogenital, blood, and endocrine diseases",6.76E+17
Sun Dec 13 06:31:09 +0000 2015,Spending extra time in office can reduce diabetes risk,Diabetes,"Diabetes, urogenital, blood, and endocrine diseases",6.76E+17
Sun Dec 13 06:31:23 +0000 2015,RT of Emerging global epidemic of diabetes is due to increases in overnight amp physical inactivity JoinTheCircle MyHealth254,Diabetes,"Diabetes, urogenital, blood, and endocrine diseases",6.76E+17
Sun Dec 13 06:31:29 +0000 2015,RT of Now effective is liraglutide in type 2 diabetic patients T2DM via medivizor,Diabetes,"Diabetes, urogenital, blood, and endocrine diseases",6.76E+17
Sun Dec 13 06:31:34 +0000 2015,RT of People who regularly sleep for longer than 10 hours have greater risk of heart disease stroke type 2 diabetes and depress,Diabetes,"Diabetes, urogenital, blood, and endocrine diseases",6.76E+17
Sun Dec 13 06:31:57 +0000 2015,RT of Clinical trials prove treatment effective improving GFR in end stage kidney disease http,kidney disease,"Diabetes, urogenital, blood, and endocrine diseases",6.76E+17
Sun Dec 13 06:32:44 +0000 2015,RT of rejuveindiamt of is an immune meditated disease where the immunesystem actually attacks the central nervously,multiple sclerosis,Neurological disorders,6.76E+17
Sun Dec 13 06:32:58 +0000 2015,RT of The stars are out to SLAM diabetes at the and Annual Am Would Rifle All Classic,Diabetes,"Diabetes, urogenital, blood, and endocrine diseases",6.76E+17
Sun Dec 13 06:33:36 +0000 2015,Memorial doctor tries to prevent diabetes by education patients,Diabetes,"Diabetes, urogenital, blood, and endocrine diseases",6.76E+17
Sun Dec 13 06:34:05 +0000 2015,Memorial doctor tries to prevent diabetes by education patients,Diabetes,"Diabetes, urogenital, blood, and endocrine diseases",6.76E+17
Sun Dec 13 06:34:08 +0000 2015,RT of Monsanto s infamous RoundUp herbicide can give you cancer even in small doses,Liver cancer,Neoplasms,6.76E+17
Sun Dec 13 06:34:53 +0000 2015,Head His Took 0228 Diabetes 60 System Or Approved Diabetes Program Burns Licks To Wash,Diabetes,"Diabetes, urogenital, blood, and endocrine diseases",6.76E+17
Sun Dec 13 06:34:56 +0000 2015,RT of In honor of Diabetes month a throwback to my first race on the sodium after being diagnosed with T1D,Diabetes,"Diabetes, urogenital, blood, and endocrine diseases",6.76E+17
Sun Dec 13 06:35:25 +0000 2015,RT of People who regularly sleep for longer than 10 hours have greater risk of heart disease stroke type 2 diabetes and depress,Diabetes,"Diabetes, urogenital, blood, and endocrine diseases",6.76E+17
Sun Dec 13 06:35:53 +0000 2015,RT of Monsanto s glyphosate found to double the risk of non Hodgkin s lympho amp multiple myeloma,Non-Hodgkin lymphoma,Neoplasms,6.76E+17
Sun Dec 13 06:36:12 +0000 2015,RT of The old face of obesity and diabetes vs the new face of obesity and diabetes,Diabetes,"Diabetes, urogenital, blood, and endocrine diseases",6.76E+17
Sun Dec 13 06:37:11 +0000 2015,RT of To Back To The Basis In Your Diabetes Are,Diabetes,"Diabetes, urogenital, blood, and endocrine diseases",6.76E+17
Sun Dec 13 06:37:33 +0000 2015,Especially that I have asthma,Asthma,Chronic respiratory diseases,6.76E+17
Sun Dec 13 06:38:01 +0000 2015,didn you say that lack of organisms causes cervical cancer DUMBASS,Cervical cancer,Neoplasms,6.76E+17
Sun Dec 13 06:38:36 +0000 2015,Workplace intervention can help prevent diabetes,Diabetes,"Diabetes, urogenital, blood, and endocrine diseases",6.76E+17
Sun Dec 13 06:38:41 +0000 2015,Diet Health Witness 0278 Road To Recovery From Parkinsons Disease,Parkinsons disease,Neurological disorders,6.76E+17
Sun Dec 13 06:39:00 +0000 2015,nodded A Medical News Roundup From John Hopkins with audit platohospital health,Diabetes,"Diabetes, urogenital, blood, and endocrine diseases",6.76E+17
Sun Dec 13 06:39:02 +0000 2015,RT of bestdietworld Diabetes factor Exposed a breakthrough 100 scientifically prove way to fight your diam,Diabetes,"Diabetes, urogenital, blood, and endocrine diseases",6.76E+17
Sun Dec 13 06:40:41 +0000 2015,It s honestly not that bad but once my asthma acts up its horrible ll,Asthma,Chronic respiratory diseases,6.76E+17
Sun Dec 13 06:41:14 +0000 2015,I m having an asthma attack cut of Rico and Tell,Asthma,Chronic respiratory diseases,6.76E+17
Sun Dec 13 06:41:27 +0000 2015,I kept coughing I m thankful for not having asthma,Asthma,Chronic respiratory diseases,6.76E+17
Sun Dec 13 06:41:36 +0000 2015,Workplace intervention can help prevent diabetes,Diabetes,"Diabetes, urogenital, blood, and endocrine diseases",6.76E+17
Sun Dec 13 06:42:11 +0000 2015,RT of People who regularly sleep for longer than 10 hours have greater risk of heart disease stroke type 2 diabetes and depress,Diabetes,"Diabetes, urogenital, blood, and endocrine diseases",6.76E+17
Sun Dec 13 06:42:30 +0000 2015,some people s posts on photo give me epilepsy sang due,Epilepsy,Neurological disorders,6.76E+17
Sun Dec 13 06:43:46 +0000 2015,RT of Breastfeeding lowers risk of type 2 diabetes for mother s with gestational diabetes,Diabetes,"Diabetes, urogenital, blood, and endocrine diseases",6.76E+17
Sun Dec 13 06:44:15 +0000 2015,An some of these take things too far Why would I willingly give myself diabetes,Diabetes,"Diabetes, urogenital, blood, and endocrine diseases",6.76E+17
Sun Dec 13 06:44:43 +0000 2015,RT of Luck diabetes,Diabetes,"Diabetes, urogenital, blood, and endocrine diseases",6.76E+17
Sun Dec 13 06:45:48 +0000 2015,Getting epilepsy over here from this rainstorm knocking out my days power and then having it come back on again and then repeating,Epilepsy,Neurological disorders,6.76E+17
Sun Dec 13 06:46:39 +0000 2015,Diabetic Diabetes Daily Fire is out Stories via Looks Creates,Diabetes,"Diabetes, urogenital, blood, and endocrine diseases",6.76E+17
Sun Dec 13 06:47:57 +0000 2015,That s up all Rough day at work Treated for asthma flare up and beginning stages of bronchitis and sinus infection Keeping an eye,Asthma,Chronic respiratory diseases,6.76E+17
Sun Dec 13 06:48:22 +0000 2015,RT of To mamma s so fat there s a strong chance of her developing type 2 diabetes,Diabetes,"Diabetes, urogenital, blood, and endocrine diseases",6.76E+17
Sun Dec 13 06:48:42 +0000 2015,RT of People who regularly sleep for longer than 10 hours have greater risk of heart disease stroke type 2 diabetes and depress,Diabetes,"Diabetes, urogenital, blood, and endocrine diseases",6.76E+17
Sun Dec 13 06:49:44 +0000 2015,RT of All I know about stalwart is that there s a spaceman with an asthma condition theforceawakens,Asthma,Chronic respiratory diseases,6.76E+17
Sun Dec 13 06:50:20 +0000 2015,guessing it s my asthma,Asthma,Chronic respiratory diseases,6.76E+17
Sun Dec 13 06:51:17 +0000 2015,RT of Today s Impact Patients amp Cannabis event on Cutis amp Epilepsy was a dream come true W http,Epilepsy,Neurological disorders,6.76E+17
Sun Dec 13 06:52:03 +0000 2015,UTM 1 his has fibro and of I have of amp severe asthma currently in flare up Other his has diabetes,Asthma,Chronic respiratory diseases,6.76E+17
Sun Dec 13 06:53:09 +0000 2015,Resilient lint atmosphere a public relations officer as prove for operating asthma act,Asthma,Chronic respiratory diseases,6.76E+17
Sun Dec 13 06:54:03 +0000 2015,RT of Image in Clinical Medicine Sullen s and Grey Turner s Signs in Acute Pancreatitis,Pancreatitis,Digestive diseases (except cirrhosis),6.76E+17
Sun Dec 13 06:54:16 +0000 2015,Louisiana mother seeks medicinal marijuana for daughter with epilepsy packs for Colorado,Epilepsy,Neurological disorders,6.76E+17
Sun Dec 13 06:55:33 +0000 2015,RT of Monsanto s glyphosate found to double the risk of non Hodgkin s lympho amp multiple myeloma,Non-Hodgkin lymphoma,Neoplasms,6.76E+17
Sun Dec 13 06:57:19 +0000 2015,I feel like my asthma is going to be acting up with this weather,Asthma,Chronic respiratory diseases,6.76E+17
Sun Dec 13 06:59:39 +0000 2015,Head s marriage to set designer Heard When on September 8 1940 lasted until his death from prostate cancer in 1979,Prostate cancer,Neoplasms,6.76E+17
Sun Dec 13 07:01:28 +0000 2015,I was in pain from gallstones and the infected gall bladder was infecting my liver I am much better,Gall bladder,Digestive diseases (except cirrhosis),6.76E+17
Sun Dec 13 07:05:22 +0000 2015,RT of i wish i had a cut laugh or one of those laughs that make other people laugh but i sound like a hyperventilating war,Asthma,Chronic respiratory diseases,6.76E+17
Sun Dec 13 07:07:05 +0000 2015,Isocyanates grain and wood dust colophony smoldering klux later and aldehydes can cause asthma,Asthma,Chronic respiratory diseases,6.76E+17
Sun Dec 13 07:09:12 +0000 2015,By dad cancer has gotten worse yet again it has spread now to his liver now is bladder bone m,Liver cancer,Neoplasms,6.76E+17
Sun Dec 13 07:09:33 +0000 2015,RT of may I can t breathe me asthma or feelings,Asthma,Chronic respiratory diseases,6.76E+17
Sun Dec 13 07:10:30 +0000 2015,Multiple sclerosis paroxysmal symptoms confused with seizures due to sudden onset multiplesclerosis,multiple sclerosis,Neurological disorders,6.76E+17
Sun Dec 13 07:13:13 +0000 2015,Study Links Breast Cancer Treatment Genetic Vulnerability to Leukaemia Risk JournalRe,Leukemia,Neoplasms,6.76E+17
Sun Dec 13 07:13:30 +0000 2015,Study Links Breast Cancer Treatment Genetic Vulnerability to Leukaemia Risk healthnew,Leukemia,Neoplasms,6.76E+17
Sun Dec 13 07:15:09 +0000 2015,RT of Helping support the fight against breast cancer for my angel Aunt Judy will donate 1,Breast cancer,Neoplasms,6.76E+17
Sun Dec 13 07:16:28 +0000 2015,Suicide gene therapy kills prostate cancer cells BBC News,Prostate cancer,Neoplasms,6.76E+17
Sun Dec 13 07:16:49 +0000 2015,RT of A breast cancer patient going for total mastectomy had a request before surgery it was to be filled dancing in O R,Breast cancer,Neoplasms,6.76E+17
Sun Dec 13 07:17:00 +0000 2015,Study Links Breast Cancer Treatment Genetic Vulnerability to Leukaemia Risk,Leukemia,Neoplasms,6.76E+17
Sun Dec 13 07:18:47 +0000 2015,RT of Gene that protects breast cancer patients against chemobrain discovered,Breast cancer,Neoplasms,6.76E+17
Sun Dec 13 07:20:03 +0000 2015,RT of Taking By Lumps cancer heart health,Breast cancer,Neoplasms,6.76E+17
Sun Dec 13 07:20:32 +0000 2015,Descriptive epidemiology of physical activity rates in multiple sclerosis,multiple sclerosis,Neurological disorders,6.76E+17
Sun Dec 13 07:24:06 +0000 2015,6 Dear Old Leukaemia Patient Decline Take A Wish Meeting With Na Garden conscioushealthsolutions health,Leukemia,Neoplasms,6.76E+17
Sun Dec 13 07:25:02 +0000 2015,Consuming Silk and Hairy Linked to the Development of Atkinson s Disease,Parkinsons disease,Neurological disorders,6.76E+17
Sun Dec 13 07:27:35 +0000 2015,RT of KSA is a politic health awareness initiative with focus on breast cancer Join us,Breast cancer,Neoplasms,6.76E+17
Sun Dec 13 07:27:36 +0000 2015,Boy rattling leukaemia for second time made contrary Navy SEAL Box News navy seals,Leukemia,Neoplasms,6.76E+17
Sun Dec 13 07:27:42 +0000 2015,Broke The Thinness World Record of the largest human awareness ribbon for breast cancer 10Ksa cancer To proud,Breast cancer,Neoplasms,6.76E+17
Sun Dec 13 07:28:05 +0000 2015,Study Links Breast Cancer Treatment Genetic Vulnerability to Leukaemia Risk breastcancer,Breast cancer,Neoplasms,6.76E+17
Sun Dec 13 07:29:18 +0000 2015,RT of Maria One too soon Luck metastatic breast cancer Beautiful words by,Breast cancer,Neoplasms,6.76E+17
Sun Dec 13 07:29:22 +0000 2015,RT of A breast cancer patient going for total mastectomy had a request before surgery it was to be filled dancing in O R http,Breast cancer,Neoplasms,6.76E+17
Sun Dec 13 07:30:04 +0000 2015,RT of His is 1 of my littleBrothers amp HisDaughter He has Acute Myeloid Leukaemia AML of s prayers,Leukemia,Neoplasms,6.76E+17
Sun Dec 13 07:30:40 +0000 2015,Acupuncture Helps CurbHotFlashes in Breast Cancer Survivor,Breast cancer,Neoplasms,6.76E+17
Sun Dec 13 07:30:55 +0000 2015,Study Links Breast Cancer Treatment Genetic Vulnerability to Leukaemia Risk,Breast cancer,Neoplasms,6.76E+17
Sun Dec 13 07:32:03 +0000 2015,sharing suave Suicide gene therapy kills prostate cancer cells BBC News therapy,Prostate cancer,Neoplasms,6.76E+17
Sun Dec 13 07:32:11 +0000 2015,Study Links Breast Cancer Treatment Genetic Vulnerability to Leukaemia Risk,Leukemia,Neoplasms,6.76E+17
Sun Dec 13 07:34:32 +0000 2015,RT of A breast cancer patient going for total mastectomy had a request before surgery it was to be filled dancing in O R,Breast cancer,Neoplasms,6.76E+17
Sun Dec 13 07:35:30 +0000 2015,His beauty brand s breast cancer ad is anything but skin deep advertising,Breast cancer,Neoplasms,6.76E+17
Sun Dec 13 07:36:22 +0000 2015,Study Links Breast Cancer Treatment Genetic Vulnerability to Leukaemia Risk JournalRe,Breast cancer,Neoplasms,6.76E+17
Sun Dec 13 07:36:22 +0000 2015,Study Links Breast Cancer Treatment Genetic Vulnerability to Leukaemia Risk JournalRe,Leukemia,Neoplasms,6.76E+17
Sun Dec 13 07:36:23 +0000 2015,Study Links Breast Cancer Treatment Genetic Vulnerability to Leukaemia Risk JournalRe,Leukemia,Neoplasms,6.76E+17
Sun Dec 13 07:38:08 +0000 2015,RT of Boy rattling leukaemia for second time made contrary Navy SEAL,Leukemia,Neoplasms,6.76E+17
Sun Dec 13 07:38:27 +0000 2015,edge Breast Cancer awareness tree yes its beautiful,Breast cancer,Neoplasms,6.76E+17
Sun Dec 13 07:39:33 +0000 2015,RT of sharing suave Suicide gene therapy kills prostate cancer cells BBC News therapy,Prostate cancer,Neoplasms,6.76E+17
Sun Dec 13 07:41:21 +0000 2015,these two people on the train breast cancer bone cancer blood cancer all easy only liver and brain difficult,Breast cancer,Neoplasms,6.76E+17
Sun Dec 13 07:44:26 +0000 2015,Study Links Breast Cancer Treatment Genetic Vulnerability to Leukaemia Risk,Leukemia,Neoplasms,6.76E+17
Sun Dec 13 07:44:49 +0000 2015,RT of K all been a bit harsh on him Join me in hoping his Eminence gets something nice for Was I m shipping in for Gros,Prostate cancer,Neoplasms,6.76E+17
Sun Dec 13 07:47:16 +0000 2015,GeneTherapy Causes Prostate Cancer Cells to He More Visible to the Immune System,Prostate cancer,Neoplasms,6.76E+17
Sun Dec 13 07:47:37 +0000 2015,GeneTherapy Causes Prostate Cancer Cells to He More Visible to the Immune System,Prostate cancer,Neoplasms,6.76E+17
Sun Dec 13 07:48:07 +0000 2015,KenyaMedicalNews Suicide Gene Therapy Hills Prostate Cancer Cells NDTV NDTVSuicide Gene Therapy AfyaKenya,Prostate cancer,Neoplasms,6.76E+17
Sun Dec 13 07:49:07 +0000 2015,RT of The beautiful women of Maude broke the record for the worlds largest human breast cancer awareness ribbon 10KSA,Breast cancer,Neoplasms,6.76E+17
Sun Dec 13 07:49:22 +0000 2015,RT of RIPHotRodWilliams PrayersUp former player passes after battle w prostate cancer,Prostate cancer,Neoplasms,6.76E+17
Sun Dec 13 07:50:26 +0000 2015,Now Cannabis Oil Helped Sure His Young Girl s Leukaemia,Leukemia,Neoplasms,6.76E+17
Sun Dec 13 07:50:41 +0000 2015,RT of The decision about abortion must remain a decision for the woman her family and physician to make not the government,Abortion,Maternal disorders,6.76E+17
Sun Dec 13 07:50:50 +0000 2015,RT of When you recognize the voice that you once heard say fuck you mean you re not getting an abortion,Abortion,Maternal disorders,6.76E+17
Sun Dec 13 07:50:54 +0000 2015,Time to Met to the Real Work of Ending Breast Cancer,Breast cancer,Neoplasms,6.76E+17
Sun Dec 13 07:51:05 +0000 2015,The Face of Abortion Give now Chained To More Radio,Abortion,Maternal disorders,6.76E+17
Sun Dec 13 07:52:05 +0000 2015,Head s marriage to set designer Heard When on September 8 1940 lasted until his death from prostate cancer in 1979 InteriorDes,Prostate cancer,Neoplasms,6.76E+17
Sun Dec 13 07:52:47 +0000 2015,NFL Dallas Cowboys Pink Broncho Parade scrape written room de breast cancer,Breast cancer,Neoplasms,6.76E+17
Sun Dec 13 07:53:30 +0000 2015,RT of When you recognize the voice that you once heard say fuck you mean you re not getting an abortion,Abortion,Maternal disorders,6.76E+17
Sun Dec 13 07:54:24 +0000 2015,That Parents Should Now about Are Breast Cancer in Children,Breast cancer,Neoplasms,6.76E+17
Sun Dec 13 07:54:28 +0000 2015,RT of When you recognize the voice that you once heard say fuck you mean you re not getting an abortion,Abortion,Maternal disorders,6.76E+17
Sun Dec 13 07:55:26 +0000 2015,RT of Sick s abortion Final reveals unspoken truths,Abortion,Maternal disorders,6.76E+17
Sun Dec 13 07:55:52 +0000 2015,Fro choice Irish women go public on being exiled by need for an abortion,Abortion,Maternal disorders,6.76E+17
Sun Dec 13 07:56:07 +0000 2015,RT of Now about we treat every young man who wants to buy a gun like every young woman who wants to get an abortion,Abortion,Maternal disorders,6.76E+17
Sun Dec 13 07:56:21 +0000 2015,Met s see anyone offended w the humane choice the won t kill babies abortion isn t choice it s murder prochoice,Abortion,Maternal disorders,6.76E+17
Sun Dec 13 07:57:31 +0000 2015,GeneTherapy Causes Prostate Cancer Cells to He More Visible to the Immune System,Prostate cancer,Neoplasms,6.76E+17
Sun Dec 13 07:58:57 +0000 2015,RT of A breast cancer patient going for total mastectomy had a request before surgery it was to be filled dancing in O R,Breast cancer,Neoplasms,6.76E+17
Sun Dec 13 08:00:02 +0000 2015,There are so many emotions you may feel when diagnosed with breast cancer all of them are normal,Breast cancer,Neoplasms,6.76E+17
Sun Dec 13 08:00:03 +0000 2015,I4U News Stress may Trigger Alzheimer s Disease in Elderly I4U News Stress contributes to many health problems,Alzheimer,Neurological disorders,6.76E+17
